ID,URL,Recipe Name,Ingredients,Instructions,Processed Ingredients
c308f7d3,https://www.melskitchencafe.com/rustic-crusty-bread-a-simple-how-to/,Easy Rustic Crusty Bread,"3 cups warm water (about 100 degrees), 1 1/2 tablespoons instant yeast, 1 tablespoon salt (I use coarse, kosher salt), 6 1/2 cups unbleached, all-purpose flour, plus more for dusting dough (see note)","In a large bowl mix yeast and salt into 3 cups lukewarm water (about 100 degrees). Stir in flour, mixing until there are no dry patches. Dough will be quite loose. Cover lightly with a kitchen towel but don't seal the bowl airtight. Let the dough rise at room temperature 2 hours (or up to 5 hours)., Bake at this point or refrigerate, covered in an airtight container, for as long as two weeks. When ready to bake, cut off a grapefruit-size piece with serrated knife (I have only ever made two loaves out of the batch of dough so I just divide the dough in half to form my first loaf). Turn the dough in your hands to lightly stretch the surface, creating a rounded top and a lumpy bottom. Put the dough on a piece of parchment paper set on a pizza peel or a rimmed baking sheet turned upside down., Slashing: you can dust the top of the dough lightly with flour and slash now (before rising) or wait until after the loaf has risen. I've found waiting and slashing the dough after rising can sometimes cause the loaf to collapse, so after making this bread for years, my preferred method is to dust the top of the loaf lightly with flour at this step, before rising, and slash the top with a baker's lame or sharp knife 3-4 times., Let the dough rest for 40 minutes for room temperature dough; if you have used the dough out of the refrigerator, let it rest for 1 1/2 hours. Repeat with remaining dough or refrigerate it., Place a broiler pan on the bottom rack of the oven (if you don't have a broiler pan - no worries! Tossing 5-6 ice cubes in the bottom of the oven when you put in the bread works really well, too). Place a baking stone on the middle rack and preheat oven to 450 degrees. Heat the stone at that temperature for 20 minutes before baking., After the dough has rested and is ready to bake, if you haven't already (see step #3), dust the dough lightly with flour, slash the top with serrated or very sharp knife three times., Slide the dough (with the parchment paper) onto the baking stone. Pour one cup of hot water into the broiler pan (or toss 5-6 ice cubes in the bottom of the oven) and shut the oven quickly but gently to trap the steam. Bake the bread until well browned, about 24-28 minutes. Cool completely.","[('water', 3.0, 'cups'), ('yeast', 1.5, 'tablespoons'), ('salt', 1.0, 'tablespoon'), ('flour', 6.5, 'cups')]"
ffbbfc8b,https://breadtopia.com/savory-stuffing-sourdough-recipe/,Savory Stuffing Sourdough Bread,"Sofrito Ingredients, 2-3 Tbsp olive oil, 1 medium onion (140g), 3 cloves of garlic (12g), 1 stalk celery (50g), 1 Tbsp dry sage, 1 Tbsp dry thyme, 1/2 tsp ground black pepper, Dough Ingredients, 275g bread flour (2 1/4 cups), 175g whole grain turkey red wheat flour (1 1/2 cups), 360g water (1 1/2 cups), 80g sourdough starter (1/3 cup), 11g salt (2 tsp), 75g dried cranberries (2/3 cup) *I like cranberry flavor in each bite. Some people prefer less and some none. This ingredient is optional. Roasted chestnuts or cooked and crumbled sausage are options too.","Sofrito, Dice the onion, garlic, and celery., Sauté the vegetables in a skillet with the olive oil, sage, thyme, and pepper until tender but not browned., Add the dried cranberries and set aside to cool., Dough, Mix together the flours, water, sourdough starter, and salt. Cover and let rest for about 30 minutes., Fold in the sofrito-cranberry mixture, cover, and let the dough ferment until it's puffy and close to doubled. This will take anywhere from 6-12 hours depending on the ambient temperature, your starter strength, and the temperature of your water and sofrito-cranberries at mixing time., Scrape the dough out onto a well-floured countertop. Gently spread the dough into a rectangle. Fold it like a letter, and then fold one more time into a square., Cover and bench rest the dough for about 20 minutes while you prep your proofing basket by dusting it with flour or bran flakes., Flour the top of the dough, flip it, and shape it into a boule, batard, or oblong loaf., Lay your dough in the basket (seam side up allows for a rough opening of the dough and seam side down allows you to score the dough for a controlled opening as it bakes)., Cover and put the basket in the refrigerator for 8-12 hours OR leave the basket at room temperature for about 1 hour., Preheat your oven and baking vessel to 500F for 30 minutes., Flour your hand and flip the dough out of the basket. Place the dough into the hot baking vessel. Score the top of the dough if the shaping seams are facing down., Bake until the internal temp is around 205 F / 96 C., 20 minutes at 500 degrees, lid on, 10 minutes at 450 degrees, lid on, 10 minutes at 450 degrees, lid off","[('olive oil', 2.0, 'tbsp'), ('onion', 140.0, 'g'), ('garlic', 12.0, 'g'), ('celery', 50.0, 'g'), ('sage', 1.0, 'tbsp'), ('thyme', 1.0, 'tbsp'), ('black pepper', 0.5, 'tsp'), ('bread flour', 275.0, 'g'), ('whole grain turkey red wheat flour', 175.0, 'g'), ('water', 360.0, 'g'), ('sourdough starter', 80.0, 'g'), ('salt', 11.0, 'g'), ('cranberries', 75.0, 'g')]"
051c7cd1,https://thepracticalkitchen.com/small-batch-crusty-bread/,Small Batch Crusty Bread,"120 grams all-purpose flour, 3 grams diamond crystal kosher salt ((see notes for other types of salt)), 1 grams instant yeast ((3 grams active dry yeast)), 100 grams cool water","Mix the flour, salt, and yeast together in a mixing bowl., Pour the water into the middle of the dry ingredients and mix until well combined. It will be shaggy and messy. That's okay. Cover the bowl and set it aside at room temp to rest for 12-20 hours (or in the fridge for up to 5 days). You're looking for the dough to double or triple in size with a flat, bubbly top., During the final hour of the rise time, preheat oven to 450°F. When the oven reaches temperature, place a Dutch oven inside, covered, and let preheat for 30 minutes at 450°F. Crumple a piece of parchment paper into a ball. Flatten it out, then crumple and flatten it out again., While Dutch oven preheats, generously flour a clean countertop. Release the dough from the sides of the bowl and onto the counter. Dust the top lightly with flour, just enough so your hands don't stick., Gently stretch the dough into a loose square. Dust any excess flour off the top. Fold the corners of the dough up and across itself to pull it into a round shape with the edges pinched together on top. Flip the loaf over so the seam side is underneath. Cup your hands around it and lightly lift and rotate the ball of dough against the counter, tucking the dough underneath itself as you go to create surface tension on top., Use the bench scraper to lift the ball of dough onto the flattened piece of crumpled parchment paper. Dust the surface of the dough lightly with flour, cover it with a clean dish towel, and let it sit until the Dutch oven finishes preheating., Carefully remove the Dutch oven from the oven. Take the lid off and set it aside. Score the top of the loaf to create a vent for steam to escape. Gather the corners of the parchment paper together, pick the dough up and place it inside the Dutch oven. Put the lid back on the Dutch oven., Bake with the lid on for 20 minutes (don't peek!), then remove the lid and bake another 10 minutes until deeply golden brown on top., Transfer the fully baked loaf to a cooling rack and let cool completely before slicing.","[('flour', 120.0, 'grams'), ('salt', 3.0, 'grams'), ('yeast', 1.0, 'grams'), ('water', 100.0, 'grams')]"
7260dae1,https://www.carnaldish.com/recipes/crusty-no-knead-artisan-bread/,Crusty No-Knead Artisan Bread,"3 cups all-purpose, or bread flour *see note below*, 1 1/2 cups warm water (90-110 degrees F), 1/4 tsp instant or rapid-rise yeast, 2 tsp kosher salt (or 1 1/2 tsp table salt)","Mix dry ingredients until combined. Add warm water and mix until flour mixture is absorbed by water. Dough will be wet and sticky. Cover with plastic wrap and store at room-temp or a turned off oven for 12-18 hours, and up to 24., Two hours before you’re ready to bake, gently pull dough out of bowl onto a heavily floured surface, being careful not to puncture too many air bubbles. Gently form into a ball. Place dough on top of cornmeal covered parchment paper and cover with a clean, floured kitchen towel for 2 hours. During the last 30 minutes of those 2 hours, pre-heat your oven and empty dutch oven to 450 degrees. Let it sit in there the entire 30 minutes. When it’s super hot, transfer the parchment/dough into the dutch oven, cover and bake for 30 minutes with the lid on. Remove lid after 30 minutes and bake an additional 5-15 minutes, or until bread registers 200 degrees on an instant read thermometer. Immediately remove bread from the hot dutch oven and let cool on a wire-rack for at least 30 minutes before slicing.","[('flour', 3.0, 'cups'), ('water', 1.5, 'cups'), ('yeast', 0.25, 'tsp'), ('salt', 2.0, 'tsp')]"
64901622,https://www.thecomfortofcooking.com/2013/04/no-knead-crusty-artisan-bread.html,No-Knead Crusty Artisan Bread,"3 cups all-purpose flour, 2 teaspoons kosher salt, not table salt, 1/2 teaspoon dry yeast, active dry or highly active dry work best, 1 1/2 cups lukewarm water, Dutch oven or any large oven-safe dish/bowl and lid*","In a large bowl, stir together the flour, salt and yeast. Stir in water using a wooden spoon until the mixture forms a shaggy but cohesive dough. Do not over-work the dough. The less you ""work"" it, the more soft, fluffy air pockets will form., Cover bowl tightly with plastic wrap. Let dough sit at room temperature for 8-24 hours*. Dough will bubble up and rise., After dough is ready, preheat oven to 450 degrees F. Place your Dutch oven, uncovered, into the preheated oven for 30 minutes., While your Dutch oven preheats, turn dough onto a well-floured surface. With floured hands, form the dough into a ball. Cover dough loosely with plastic wrap and let rest., After the 30 minutes are up, carefully remove Dutch oven. With floured hands, place the bread dough into it. (You can put a piece of parchment under the dough if your Dutch oven isn’t enamel coated.), Replace cover and bake for 30 minutes covered. Carefully remove cover and bake for 7-15 minutes* more, uncovered., Carefully remove bread to a cutting board and slice with a bread knife., Enjoy!, Uncovered baking time depends on your oven. In my oven, the bread only needs 7 minutes uncovered until crusty and golden brown, but this can vary. Just keep an eye on it!, Preheating your Dutch oven to 450 degrees F will not damage it, or the knob on top., I’ve let this dough rise anywhere between 8-24 hours and it has baked up beautifully. Just make sure it has risen and appears to “bubble” to the surface., There’s no need to grease the Dutch oven/baking dish/pot, . My bread has never stuck to the pot. If you are concerned though, put a piece of parchment paper under your dough before placing into your pot., I do not recommend using whole wheat flour or white whole wheat flour in this recipe. The resulting bread will be very dense, and not as fluffy and delicious., I used a 5.5 quart enameled cast iron Le Creuset pot, but you can use any large oven-safe dish and cover. All of these also work: a baking dish covered with aluminum foil, crockpot insert, stainless steel pot with a lid, pizza stone with an oven-safe bowl to cover the bread, and old cast iron Dutch oven., Add any mix-ins you like - herbs, spices, dried fruit, chopped nuts and cheese all work well. I recommend adding them into the initial flour-yeast mixture to avoid over-working the mix-ins into the dough. The less you ""work"" it, the more you're encouraging soft, fluffy air pockets to form!","[('flour', 3.0, 'cups'), ('salt', 2.0, 'teaspoons'), ('yeast', 0.5, 'teaspoon'), ('water', 1.5, 'cups')]"
aca8f051,http://cooklikeyourgrandmother.com/how-to-make-crusty-italian-bread/,Crusty Italian Bread,"1 package (2½ teaspoons) active dry yeast, 1¼ cups warm water (105-115°), 3 cups bread flour or all-purpose flour, 2 teaspoons sugar, 1 teaspoon salt, 1 tablespoon olive oil, cornmeal for dusting","Combine yeast, water, 1 teaspoon of sugar and 1 cup of flour in mixing bowl. Allow to rest for 10 minutes until the yeast starts bubbling and giving off a ""yeasty"" smell., Add the remaining flour, sugar and salt and mix until the flour is incorporated. Add the olive oil and knead for 10 minutes, until the dough is smooth and satiny., Place the dough in an oiled bowl, coating the dough all around with the oil. Cover with plastic wrap or a wet tea towel and place in a warm spot until the dough has doubled in volume -- 45 minutes to an hour or more, depending on temperature., Punch down the dough, roll into desired loaf shape, cover with plastic again and allow to rise until doubled in volume., Place a bowl of water in the stove and pre-heat to 425°. Turn down to 400 when you put the bread in. Bake 20-30 minutes, depending on shape of loaves. Bread is finished when it makes a hollow sound when you thump on the bottom with your thumb.","[('yeast', 2.5, 'teaspoons'), ('water', 1.25, 'cups'), ('flour', 3, 'cups'), ('sugar', 2, 'teaspoons'), ('salt', 1, 'teaspoon'), ('olive oil', 1, 'tablespoon'), ('cornmeal', None, None)]"
dc124517,https://www.allrecipes.com/recipe/281201/crusty-dutch-oven-bread/,Crusty Dutch Oven Bread,"4 cups bread flour, 1 ½ cups water, 2 teaspoons salt, 1 teaspoon active dry yeast, cooking spray","Place bread flour into the bowl of an electric stand mixer and pour in water, followed by salt. Sprinkle yeast over the surface and allow to dissolve and turn creamy, about 5 minutes., Mix on medium speed using the paddle attachment until dough comes together. Replace the paddle with the dough hook and continue mixing until dough is smooth and elastic, about 10 minutes., Cover the bowl with plastic wrap and allow dough to rise until doubled in size, 30 to 45 minutes. Push a finger into dough; it should give some resistance, but not spring back. If it springs back, let it rise longer., Turn dough out onto a floured surface and punch down to expel excess gas and redistribute yeast. Cover with a clean dish towel and let rest, 10 to 15 minutes., Shape dough into a boule by pushing it back and forth on the counter in a circular motion until you have a round, smooth ball. Cover dough with a clean dish towel and allow to rise, about 1 hour., Preheat the oven to 450 degrees F (230 degrees C). Grease a Dutch oven with cooking spray., Slice a very shallow ""X"" into the top of dough with a sharp knife to help it expand while baking. Place loaf into the prepared Dutch oven and cover with the lid., Bake in the preheated oven for 10 minutes. Reduce temperature to 375 degrees F (190 degrees C) and continue to bake, covered, for 20 minutes. Remove the lid and continue baking until loaf is deep golden, 25 to 30 minutes.","('[('bread flour', 4.0, 'cups'), ('water', 1.5, 'cups'), ('salt', 2.0, 'teaspoons'), ('active dry yeast', 1.0, 'teaspoon')]')"
be0be732,https://71toes.com/home-made-crusty-bread/,Home-Made Crusty Bread,"3 c. flour, 1/4 tsp. yeast, 1 1/2 tsp. salt, 1 1/2 c. water","THAT IS IT!, The mixture will still be kind of dry and flakey and that's ok. Cover with saran wrap and leave for 12-24 hours. Just right on the counter (don't refrigerate). Most of the times I've baked this I made mixed the ingredients the night before, and it was ready to bake for dinner the next night. One time I left the dough for almost two days and it was still really good, just more of a sourdough taste., When you're ready to bake put your empty pot (with lid on) in your oven and turn it on to 450 degrees. (You want the pot to heat up in the oven so it's ready to bake that bread from the inside when you're ready.), While the oven heats, take out the dough, mix it for a minute, and set it on a floured piece of parchment paper, covered with the saran wrap. It should sit for about 30 min. The recipe HERE gives instructions on how to make cuts in the top if you want it to look extra fancy., After the oven and pot are all hot and ready, carefully take out the pot (it will be super hot), and put the parchment with dough on it into the pot. (BE SO CAREFUL not to forget that the lid is super hot!...I almost grabbed it one time and that would be bad.), Put the lid back on and stick it in the oven., Bake for 28 minutes, then take off the lid and bake to brown it up for another 12-15 min., Take it out of the oven and remove from the pot on a cooling rack., Serve with whatever you want...I love it with olive oil with seasonings mixed in.","('flour', 3.0, 'c'), ('yeast', 0.25, 'tsp'), ('salt', 1.5, 'tsp'), ('water', 1.5, 'c')"
e5fb846a,https://www.tasteofhome.com/recipes/crusty-homemade-bread/,Crusty Homemade Bread,"1-1/2 teaspoons active dry yeast, 1-3/4 cups warm water (110° to 115°), 3-1/2 cups plus 1 tablespoon all-purpose flour, divided, 2 teaspoons salt, 1 tablespoon cornmeal or additional flour","In a large bowl, dissolve yeast in warm water. Using a rubber spatula, stir in 3-1/2 cups flour and salt to form a soft, sticky dough. Do not knead. Cover and let rise at room temperature 1 hour., Stir down dough (dough will be sticky). Turn onto a floured surface; with floured hands pat into a 9-in. square. Fold square into thirds, forming a 9x3-in. rectangle. Fold rectangle into thirds, forming a 3-in. square. Place in a large greased bowl, turning once to grease the top. Cover and let rise at room temperature until almost doubled, about 1 hour., Punch down dough and repeat folding process. Return dough to bowl; refrigerate, covered, overnight., Grease the bottom of a disposable foil roasting pan with sides at least 4 in. high; dust pan with cornmeal. Turn dough onto a floured surface. Knead gently 6-8 times; shape into a 6-in. round loaf. Place into prepared pan; dust top with remaining 1 tablespoon flour. Cover pan and let rise at room temperature until dough expands to a 7-1/2-in. loaf, about 1-1/4 hours., Preheat oven to 500°. Using a sharp knife, make a slash (1/4 in. deep) across top of loaf. Cover pan tightly with foil. Bake on lowest oven rack 25 minutes., Reduce oven setting to 450°. Remove foil; bake bread until deep golden brown, 25-30 minutes. Remove loaf to a wire rack to cool.","[('yeast', 1.5, 'teaspoons'), ('water', 1.75, 'cups'), ('flour', 3.5, 'cups'), ('salt', 2, 'teaspoons'), ('cornmeal', 1, 'tablespoon')]"
19f523ad,https://butterandair.com/high-altitude-crusty-french-bread/,High Altitude Crusty French Bread,"2 tsp dry active yeast, 1 tsp sugar, 1 1/4 cups warm (not hot) water, 2.5 cups bread flour, 2 tsp kosher salt","In a small bowl, combine water, yeast, and sugar., In a separate medium bowl or the bowl of a stand mixer, combine flour and salt and stir to mix. Add liquid and stir until the dough begins to come together in a ball. If it seems too dry, add a little more water, 1 tablespoon at a time. Mix until all the flour is incorporated and the dough is craggy and sticky, then tip the dough out onto a floured surface for kneading (or leave in stand mixer to knead with bread hook)., Knead for 10-15 minutes, until dough is smooth, and elastic, and slightly tacky to the touch. Form into a ball and place in a medium bowl that’s been lightly oiled. Cover the bowl tightly with plastic wrap and allow dough to rise at room temperature 1-2 hours, until doubled in size., Remove the dough to a floured surface and give it a pull-and-stretch: Stretch about a quarter of the dough ball away from you, then fold it back on top of itself, ending in the middle. Turn the dough a quarter-turn and repeat three more times, so all sides have been folded in. Flip the dough upside down, pat into a ball, and place on a piece of parchment paper., (At this point, if you do not plan to bake the bread the same day, you can place it in a bowl, cover it tightly, and refrigerate it overnight, or up to 18 hours. Remove the bread and allow it to come to room temperature, about one hour, before baking)., Cover dough loosely with plastic wrap or a tea towel and allow to rise about 30-45 minutes, until it has reached approximately 1.5 times its size., While the dough is proofing, place dutch oven or other large lidded, oven-proof pot on the middle rack of the oven and preheat to 450 degrees (alternatively, if you are baking in the open oven without a container, place a roasting pan on the bottom rack and add one inch of hot water just before baking the bread)., When the dough is ready to bake, score it. Using a very sharp knife or razor blade, quickly and gently make a quarter-inch deep slash in the dough, from one end of the loaf to the other (or other design of your choice). Be sure not to press too hard and deflate the dough., Using heat-proof gloves or oven mitts, carefully remove the dutch oven from the oven and remove the lid. Pick up the edges of the parchment paper and gently lift the dough into the dutch oven, parchment and all (if not using a dutch oven, place on a baking sheet or stone). Replace lid and put the pot back in the oven., Bake for 25 minutes, then reduce the temperature to 400 degrees and bake another 30 minutes. Check after a total of 40 minutes or so; if the loaf has not browned much, remove the lid and continue baking uncovered., The bread is done when the crust is hard and has a hollow sound when rapped with a knuckle. You can also use an instant-read thermometer to check the internal temp – if it’s between 190 and 205 degrees, it’s done., Cool the loaf on a baking rack for at least 20 minutes, or until it is fully cooled. Slice at room temperature. Store leftover bread tightly wrapped in plastic wrap.","[('yeast', 2.0, 'tsp'), ('sugar', 1.0, 'tsp'), ('water', 1.25, 'cups'), ('flour', 2.5, 'cups'), ('salt', 2.0, 'tsp')]"
3c54f8a2,https://zoebakes.com/2022/03/05/crusty-bread/,Sublime Crusty Bread,"500 g flour (I used King Arthur all-purpose flour), 375 g water (room temperature), 1 1/2 tsp yeast (I used Platinum Yeast by Red Star*, but any granulated instant yeast will work.), 1 tbsp honey, 1 tsp kosher salt","Using a spoon mix 125g flour and 100g water in the bowl of a stand mixer and allow to rest for 15 minutes., Add the remaining flour, salt, water, yeast, and honey to the flour/water mixture and knead with the dough hook attachment on medium-high speed until the dough is smooth and elastic, about 5 minutes., Cover the bowl with plastic wrap or a damp towel and allow to rest for 20 minutes., Reach into the bowl with a plastic bowl scraper and stretch the sides of the dough up and over the center of the dough, it may take about 5 or 6 times to move all the way around the bowl, creating a loose ball. Cover the bowl and allow to rest for 1 hour or until the dough has doubled in size., Turn the dough out of the bowl onto a lightly floured surface. Pull the dough into an oval with the short end closest to you. Fold the top end of the dough into the middle. Stretch the bottom end of the dough out to the sides, to create a rough triangle shape, then fold those two stretched points into the center. Flip the dough over, so the smooth side is now up and scoot the bottom of the dough in a circular motion on the counter to create a tight ball., Dust a proofing basket** with flour and put the dough ball, smooth side down into the basket. Cover with plastic and allow to rest about 1 hour., Preheat the oven to 475°F. On a rack in the middle of the oven, heat a 6-quart Sublime Dutch Oven*** for about 20 minutes before baking., Invert the dough onto a sheet of parchment paper. Using a knife or Lame, score the top of the dough with ½-inch-deep slashes., Using the parchment as a sling, gently drop the dough into the preheated pot, cover and bake for about 35 covered. Remove the cover and continue baking for 10 minutes or until the bread is deeply caramel brown., Carefully remove from the Sublime Dutch Oven using a spatula to help lift it out and cool to room temperature before cutting., Rate and Review!, If you've made this recipe, please leave a rating and review! I love to hear how you've adapted my recipes to your own tastes, so please share how it went for you. It helps other people find my recipes. Thank you!","[('flour', 500.0, 'g'), ('water', 375.0, 'g'), ('yeast', 1.5, 'tsp'), ('honey', 1.0, 'tbsp'), ('kosher salt', 1.0, 'tsp')]"
263e9146,https://instantloss.com/crusty-french-bread/,Crusty French Bread,"1 1/2 cup Filtered Water, 2 tsp Grass-fed Butter, 4 cups Organic Unbleached Flour, 4 tsp Organic Sugar, 1 1/2 tsp Sea Salt, 1 tsp Chia Seeds (optional), 1 3/4 tsp Active Dry Yeast","Place ingredients in the order listed into your bread machine., Select the FRENCH bread setting, SELECT., MEDUIM color, SELECT., LARGE loaf size, SELECT., Press START. Bread will be done baking in the number of hours indicated.","[('filtered water', 1.5, 'cup'), ('grass-fed butter', 2.0, 'tsp'), ('organic unbleached flour', 4.0, 'cups'), ('organic sugar', 4.0, 'tsp'), ('sea salt', 1.5, 'tsp'), ('chia seeds', 1.0, None), ('active dry yeast', 1.75, 'tsp')]"
