ID,URL,Recipe Name,Ingredients,Instructions,Processed Ingredients
e8158bca,https://makeitdough.com/sourdough-molasses-cookies/,Chewy Sourdough Molasses Cookies,"113 grams unsalted butter (softened), 113 grams organic cane sugar, 113 grams organic dark brown sugar, 85 grams organic blackstrap molasses, 1 teaspoon organic vanilla extract, 57 grams sourdough discard, 255 grams organic all purpose flour, 3/4 teaspoon Chinese five spice, 1/2 teaspoon fine sea salt, 1/2 teaspoon baking soda, 57 grams organic cane sugar, 3 whole cloves, 2 cinnamon sticks, 6 grams fennel seeds, 3 teaspoons Sichuan peppercorns, 5 star anise","Cream the butter and sugars: Using a hand mixer or a stand mixer fitted with a paddle attachment, cream the butter, cane sugar, dark brown sugar, molasses, and vanilla extract. Mix on low until combined, then speed mixer up to medium and continue to cream the butter mixture for 5 minutes, until it is noticeably lighter in color., Make the dough: Add the sourdough discard, flour, Chinese five spice, baking soda, and salt in that order. Mix on low until combined into a stiff dough., Prep: Line one baking sheet with parchment paper. Pour the cane sugar for the topping into a bowl. Set aside., Portion out your cookie dough: Using your hands, or a 1 ½ tablespoon cookie scoop, form or scoop the dough into 22 balls and roll them in the cane sugar. Place on the prepared baking sheet., Chill dough: Refrigerate the baking sheet for at least 1 hour, or you can refrigerate overnight., Prepare for baking: Preheat the oven to 375°F. Line another baking sheet with parchment paper. Transfer half the cookie dough balls onto the second baking sheet, and space them all at least 1-inch apart., Bake: Bake for 10 to 12 minutes, or until the cookies look puffed and dry around the edges. Allow to cool completely on the baking sheets., Enjoy and store: These cookies are best enjoyed once they are fully cooled and are even better a few days after being baked. Store in an airtight container for up to 7 days., High Altitude: Bake at 375°F for 8 to 10 minutes, or until the cookies look puffed and dry around the edges., To make the five spice:, Toast the whole spices in a small pan over medium high heat until fragrant, about 1 to 2 minutes, Grind the toasted spices in a spice grinder until you have a fine powder, Store excess five spice in an airtight container for up to 6 months","[('butter', 113.0, 'grams'), ('sugar', 113.0, 'grams'), ('sugar', 113.0, 'grams'), ('molasses', 85.0, 'grams'), ('vanilla extract', 1.0, 'teaspoon'), ('discard', 57.0, 'grams'), ('flour', 255.0, 'grams'), ('spice', 0.75, 'teaspoon'), ('salt', 0.5, 'teaspoon'), ('soda', 0.5, 'teaspoon'), ('sugar', 57.0, 'grams'), ('cloves', 3.0, None), ('cinnamon', 2.0, 'sticks'), ('fennel seeds', 6.0, 'grams'), ('peppercorns', 3.0, 'teaspoons'), ('anise', 5.0, None)]"
b69a127e,https://anoregoncottage.com/pantry-basic-baked-chewy-granola-bars/,Easy Baked Chewy Granola Bars,"1/2 cup butter*, 1/4 cup coconut oil (or use all butter or more coconut oil, if you prefer- just equal 3/4 c. total fat), 1 cup honey (or a mix of 1/2 cup honey + 1/2 cup maple syrup, or all maple syrup), 1 tsp. vanilla, 4-1/2 cup rolled oats, 1 cup whole wheat or spelt flour, 1/4 cup flax seed meal, 1 teaspoon baking soda, 1 cup TOTAL add-ins - some favorite flavor combos are:, 1/3 cup chocolate chips** + 1/2 cup sunflower seeds (whole flaxseeds, or hemp seeds), 1/2 cup dried cranberries + 1/2 cup chopped almonds, 1/2 cup raisins + 1/2 cup chopped peanuts","Line a 13"" x 9"" pan with parchment (or grease lightly) and preheat the oven to 325 degrees., Combine the butter, coconut oil, honey, and vanilla in a large bowl and cream together well. Add the oats, flour, flax meal, and baking soda and mix well. Stir in the add-ins., Transfer to prepared pan and firmly press mixture evenly., Bake for 18-20 minutes, until the edges are just browning. Let cool on a rack for 10 minutes, then score into bars (18 - cut 6 x 3 - for traditional bar size or 16 or 20 long and narrow bars) before letting cool completely in the pan., Remove from pan, cutting through bars as needed and store in air tight containers or baggies in the fridge or freezer. These are good at room temperature, too (which is nice for vacations and hikes), but I usually stick them in the freezer for longer storage - they freeze great!","[('butter', 0.5, 'cup'), ('coconut oil', 0.25, 'cup'), ('honey', 1.0, 'cup'), ('maple syrup', 0.5, 'cup'), ('vanilla', 1.0, 'tsp'), ('rolled oats', 4.5, 'cup'), ('whole wheat flour', 1.0, 'cup'), ('spelt flour', 1.0, 'cup'), ('flax seed meal', 0.25, 'cup'), ('baking soda', 1.0, 'teaspoon'), ('chocolate chips', 0.33, 'cup'), ('sunflower seeds', 0.5, 'cup'), ('dried cranberries', 0.5, 'cup'), ('chopped almonds', 0.5, 'cup'), ('raisins', 0.5, 'cup'), ('chopped peanuts', 0.5, 'cup')]"
0bfd7302,https://www.oliviascuisine.com/authentic-brazilian-cheese-bread/,Authentic Brazilian Cheese Bread (Pão de Queijo),"4 cups tapioca flour, 1 1/4 cups milk, 1/2 cup water, 6 tablespoons oil, 1 1/2 cups grated parmesan cheese, 1 cups shredded Mozzarella cheese, 2 large eggs, 2 teaspoons salt","Preheat oven to 400F degrees with a rack in the middle., Combine the milk, water, oil and salt in a saucepan and bring to a boil over medium high heat., Add the tapioca flour to the bowl of a stand mixer and, once the milk mixture boils, pour it over the flour. Turn the mixer on and mix it well. The texture will be fondant-like, really white and sticky., With the mixer still on, add the eggs, one at a time. You will think they won't mix, since the tapioca flour mixture is so sticky, but hang in there cause they will., Once the eggs are incorporated, add the cheese, a little at a time, until fully incorporated., The dough is supposed to be soft and sticky. However, if you're worried it's too liquidy, add some more tapioca flour. Just don't over do it or your cheese bread will be tough and not too gooey., To shape the balls, wet your hands with cold water and, using a spoon, scoop some of the dough to shape balls that are a little smaller than golf-sized., Place the balls on a baking sheet covered with parchment paper and bring it to the preheat oven., Bake for 15-20 minutes or until they are golden and puffed., Serve them warm! :)","[('tapioca flour', 4.0, 'cups'), ('milk', 1.25, 'cups'), ('water', 0.5, 'cup'), ('oil', 6.0, 'tablespoons'), ('parmesan cheese', 1.5, 'cups'), ('mozzarella cheese', 1.0, 'cups'), ('eggs', 2.0, None), ('salt', 2.0, 'teaspoons')]"
5ee48b87,https://www.latinofoodie.com/recipes/capirotada-recipe/,Grandma's Capirotada Recipe,"6 cups of water, 3 Piloncillo cones, 3 Mexican cinnamon sticks, 3 whole cloves, 1 cup raisins, 1/2 cup roasted, salted peanuts, 12 thick slices of bolillo or French bread (see note below), 2 cups of shredded Monterey Jack Cheese","Preheat over to 350 degrees, In a medium-sized stockpot, add the water, piloncillo, cinnamon sticks, and cloves over medium-high heat. Allow the piloncillo to completely dissolve and the syrup thickens (about 10 to 15 minutes)., Slice the bolillos about 1/3 inch thick and assemble on a baking sheet. Place in the oven for about 15 to 20 minutes to toast., In a deep 9x9 inch baking dish, use some cooking spray on the bottom of the baking dish., In layers, add the toasted bread, sprinkle raisins, peanuts and cheese. Continue with the next layer until you have a full baking dish adding extra cheese and raisins on top., Spoon the syrup over the assembled dish until all the bread is moist., Bake for 40 minutes until golden brown., Enjoy warm.","[('water', 6.0, 'cups'), ('piloncillo', 3.0, None), ('cinnamon sticks', 3.0, None), ('cloves', 3.0, None), ('raisins', 1.0, 'cup'), ('peanuts', 0.5, 'cup'), ('bolillo', 12.0, 'slices'), ('monterey jack cheese', 2.0, 'cups')]"
3851c968,https://amberskitchencooks.com/classic-white-bread/,Classic White Bread,"3 cups warm water (baby bottle temperature), 1 1/2 T active dry yeast, 3/4 cup sugar or honey, 1 T salt, 1 egg beaten, 1/3 cup coconut oil, melted, 8 1/2 cups all-purpose flour or bread flour, give or take 1/2 cup","For bread loaves use 3, 1/5-quart loaf pans or pans that measure 4x8 or 5x9., Combine water, yeast, and sugar. Mix gently. Cover and let the yeast proof for ten minutes. If yeast does not foam up then do not move forward, start again with new yeast., Add salt, egg, and oil. Mix to combine., Add flour, cup by cup mixing in between each addition. You have enough flour when 1- the dough starts to pull away from the sides of the bowl, 2- the dough becomes tacky but not overly sticky in texture. Use the touch test (below) to determine if the dough has the right amount of flour. If it doesn’t have enough, add a little flour and knead. If it has too much flour, add a teaspoon of oil and knead. Do not add too much flour!, Touch test: after kneading the dough, touch it with 3 fingers. If a lot of dough sticks to your fingers, it needs more flour. If hardly any sticks to your fingers it’s just right. If it is dry and crumbly with pockets of visible flour, it has too much flour. Kneading the dough for a few extra minutes can help hydrate any excess flour., Knead the dough for 10-15 minutes. Cover with a clean kitchen towel or with a bowl lid or with plastic wrap. Let rise until it has doubled in size (about one hour)., Punch down dough and dump onto a clean, floured surface. Divide into portions of either 3 loaves, 9 mini loaves, or 24-32 rolls. Form into the desired shape, and set on a greased cookie or greased loaf pan and cover with plastic wrap, a lid, or a clean dish towel. Allow to rise again until doubled in size. Preheat oven to 375° F for bread or 350° F for rolls., Bake. - 3 large loaves bake at 375° F for 25-30 minutes or until the thermometer reads 180° F at the center of the loaf. - 9 mini loaves bake at 375° F for 22-25 minutes or until the thermometer reads 180° F at the center of the loaf.- 32 rolls (16 per cookie sheet) bake at 350° F for 17-20 minutes.- 24 rolls (12 per cookie sheet) bake at 350° F for 17-20 min, Remove from oven and let cool. Remove bread from bread pans and onto a cooling rack immediately so they don’t condensate and get soggy. Spread tops with melted butter if you want., Let bread/ rolls cool completely, then they can be stored in twist tie bread storage bags.* They will last well at room temperature for 4-5 days, but remember that they do not have any preservatives in them so they may start to mold around day 7. I recommend freezing whatever won't be used within 4-5 days.","['(water, 3, cups)', '(yeast, 1.5, tablespoons)', '(sugar, 0.75, cups)', '(salt, 1.0, tablespoon)', '(egg, 1.0, None)', '(coconut oil, 0.33, cups)', '(flour, 8.5, cups)']"
581f0d87,https://findingtimeforcooking.com/bread-recipes/traditional-irish-brown-bread/,Traditional Irish Brown Bread,"1 cup of coarse whole wheat flour; see notes, 2 cups of white flour (sometimes I use part whole wheat here), 1 cup of wheat bran, 1 dessert spoon of wheat germ or ground flaxseeds, 1 3/4 teaspoons of baking soda, 1 ounce of butter or 4 tablespoons of oil (I recommend oil for a more moist bread), A heavy pinch of kosher salt (like 1/2 teaspoon), 3 cups of buttermilk or sour milk","Preheat oven to 370 F (180 C)., Combine dry ingredients in a bowl., Stir in the wet ingredients, mixing well into a soft dough (really more of a thick batter)., Transfer your batter to a large loaf tin (non-stick, or if it's not then grease it). Make sure to level out the top of the batter so it bakes evenly., Bake for at least 40 minutes…that’s what the recipe says, but I found it needed 60-85 minutes depending on the day and ingredients used. Maybe my loaf tin is a bit smaller than what Jimmy uses., The bread is cooked if it sounds hollow when the loaf is tapped on the bottom, and a thermometer inserted reads around 200 F. When you think it’s done, give it 5 more minutes., Let it cool in the tin for about 10 minutes, then turn out on a cooling rack. Try not to cut into it until it’s down to around 80 F inside (if you can wait!).","[('coarse whole wheat flour', 1.0, 'cup'), ('white flour', 2.0, 'cups'), ('wheat bran', 1.0, 'cup'), ('wheat germ', 1.0, 'dessert spoon'), ('baking soda', 1.75, 'teaspoons'), ('butter', 1.0, 'ounce'), ('buttermilk', 3.0, 'cups')]"
8997e20c,https://www.food.com/recipe/naan-56245,Traditional Naan Bread,"2/3 cup milk (or water), 2 cups all-purpose flour, 2 teaspoons onion seeds, 1 teaspoon yeast (Dry), 1 teaspoon sugar, 1 teaspoon salt, 4 tablespoons clarified butter, 2 tablespoons yoghurt","Whisk warm milk/water with the yeast and sugar until the yeast is dissolved., Cover and let stand in a warm place for 10 minutes., Sift flour and salt three times into a large bowl add the yeast mixture, half of the ghee and the yogurt., Mix into a soft dough then knead on a floured surface for about 5 minutes or until dough is smooth and elastic., Place the dough in a large greased bowl, cover and let stand in a warm place for 1 1/2 hours or until the dough is doubled in size., Punch down dough then knead for 5 minutes., Divide dough into 6 pieces., Roll each piece out into 8 inch round nans., Cover an oven tray with foil and grease the foil., Brush the nan with a little of the remaining ghee and sprinkle with some of the kalonji., Cook Nan one at a time under a very hot grill for about 2 minutes on each side or until puffed and just browned.","[('milk', 0.67, 'cup'), ('flour', 2.0, 'cups'), ('onion seeds', 2.0, 'teaspoons'), ('yeast', 1.0, 'teaspoon'), ('sugar', 1.0, 'teaspoon'), ('salt', 1.0, 'teaspoon'), ('clarified butter', 4.0, 'tablespoons'), ('yoghurt', 2.0, 'tablespoons')]"
b2a45fe5,https://www.kitchensanctuary.com/homemade-flatbread-recipe/,Homemade Flatbread Recipe,"7 g (2 tsp) instant dry yeast, 480 ml (2 cups) warm water, 4 tbsp olive oil (plus extra for brushing (approx 2-3 tbsp)), 780 g (6 ½) cups strong bread flour (plus extra for rolling (approx 60g or 1/2 cup)), 1 ½ tsp sugar, 1 ½ tsp table salt","Place the yeast in the bowl of a stand mixer (or a large bowl) and add the warm water. Stir together and leave for 5 minutes, until foam appears on top of the water., Add the olive oil, flour, sugar, and salt to the yeast mixture., Mix the dough together using either using a stand mixer with a dough hook (recommended) or your hands, until combined., Once combined, knead the dough for 10 minutes using the stand mixer with a dough hook or by hand. The mixture will be quite sticky, so if you’re kneading by hand, it’s a good idea to coat your hands and work surface in a little olive oil to stop it sticking., Place the dough in an oiled bowl, cover with a damp cloth or clingfilm and allow to prove for 60-90 minutes, until doubled in size., Divide the dough into 12 pieces. Shape into balls and place on a tray or board with a damp cloth over the top to rest for a few minutes, while you prepare to start cooking them., Lightly flour the work surface., Brush or spray a medium-sized frying pan (cast iron gives you the best results) with a little oil (just 1/4 tsp or so) and place over a medium-high heat to heat up., Take one of the dough balls, and roll it into a circle, about 19cm (7.5 inches) in diameter and ½ cm (just under ¼ inch) thick., Toss the pita back and forth a couple of times in your hands to remove excess flour, then place the pita in the pan., Brush the top of the pita in the pan lightly with oil and cook for about 60-90 seconds, until bubbles start to appear. Then turn over a cook for a further minute., Place on a plate and repeat, brushing the pan with oil after every 3 or 4 pitas., Stack the pitas up on a plate (stacking them helps to keep them soft), laying a tea towel over them to keep warm until you’re ready to serve.","[('yeast', 7.0, 'g'), ('water', 480.0, 'ml'), ('olive oil', 4.0, 'tbsp'), ('bread flour', 780.0, 'g'), ('sugar', 1.5, 'tsp'), ('table salt', 1.5, 'tsp')]"
e7a6bf12,https://www.food.com/recipe/irish-rosies-irish-soda-bread-20616,Rosie's Traditional Irish Soda Bread,"3 1/2 cups flour, 1/2 cup sugar, 1/2 teaspoon baking soda, 2 teaspoons baking powder, 1 teaspoon salt, 1 pint sour cream, 2 eggs, 2 tablespoons caraway seeds (optional but I always use them), 3/4 cup raisins","Combine dry ingredients together in a large bowl., In a small bowl beat eggs and stir in sour cream., Add the egg and sour cream mixture to the dry ingredients and stir with a wooden spoon., Batter will be very thick., Add the raisins and caraway seeds and stir well with wooden spoon or knead in with your hands., Place batter in a greased 9 inch springform pan., Dust the top with enough flour so that you can pat the batter like a bread dough evenly in the pan without it sticking to your hands., With a knife make a shallow crisscross on the top., Bake for 50 minutes in a preheated 350ºF oven.","[('flour', 3.5, 'cups'), ('sugar', 0.5, 'cup'), ('baking soda', 0.5, 'teaspoon'), ('baking powder', 2.0, 'teaspoons'), ('salt', 1.0, 'teaspoon'), ('sour cream', 1.0, 'pint'), ('eggs', 2.0, None), ('caraway seeds', 2.0, 'tablespoons'), ('raisins', 0.75, 'cup')]"
3b38794a,https://topwithcinnamon.com/short-and-sweet-1/,Pecan-Raisin Cinnamon Swirl Bread {Vegan},"2 1/2 tsp (a 1/4 oz packet) active dried yeast, 1 cup (250 ml) warm water, 4 tbsp raw sugar, 2 tbsp vegetable oil (, plus extra for greasing), 3 1/2 cups (450 g) bread flour, plus you may need extra for kneading/rolling (I'd recommend weighing the flour, if you can), 1 tsp salt, 3/4 cup (100 g) pecans, roughly chopped, 1/2 cup (75 g) raisins, 3 tbsp coconut oil (, softened), 1/2 tsp all purpose flour, 3 tbsp raw sugar, 1 tsp ground cinnamon","Combine the warm water, yeast and sugar in a large bowl. Stir in the oil, then 1 1/2 cups of the flour. Mix in another 1 cup of the flour, reserving 1 cup., Sprinkle 1/2 cup of the flour onto a clean work surface. Tip the contents of the bowl out onto the floured work surface and knead for 5-10 minutes until it's smooth (sprinkle on more flour as you knead if it seems too sticky)., Lightly grease the bowl with some oil, put the dough into the bowl, cover with a clean dish towel. Leave in a warm place to rise until doubled in size (around 1 hour). Once risen, tip the dough out onto a clean work surface, pat it out into a circle and sprinkle with the pecans and raisins. Fold the dough in half and knead it for a few minutes until the pecans and raisins are evenly distributed in the dough. Leave the dough to rest whilst you make the filling., In a small bowl, cream together the coconut oil, flour, sugar and cinnamon., Sprinkle some more flour under the dough and on top of it, then roll it into an 8.5-inch square (see notes). Spread the filling mixture evenly over the surface then roll the dough up tightly into log. Transfer the log to a greased 8.5-inch loaf tin and place it seam side down in the tin. Cover loosely with oiled plastic wrap. Leave to rest for 30 minutes in a warm place., Remove the plastic wrap and bake for 30-40 minutes in an oven preheated to 350 F (180 C) until well-risen and browned. Let the loaf cool for a few minutes in the tin before tipping it out onto a cooling rack to cool completely, before slicing.","[('yeast', 2.5, 'tsp'), ('water', 1.0, 'cup'), ('sugar', 4.0, 'tbsp'), ('oil', 2.0, 'tbsp'), ('flour', 3.5, 'cups'), ('salt', 1.0, 'tsp'), ('pecans', 0.75, 'cup'), ('raisins', 0.5, 'cup'), ('coconut oil', 3.0, 'tbsp'), ('flour', 0.5, 'tsp'), ('sugar', 3.0, 'tbsp'), ('cinnamon', 1.0, 'tsp')]"
f8c8e6ac,https://www.bonappetit.com/recipe/old-school-garlic-bread,Classic Garlic Bread,"½ cup cup (1 stick) unsalted butter, ¼ cup cup extra-virgin olive oil, 2 cloves garlic cloves, peeled, crushed, Large handful of fresh flat-leaf parsley leaves, finely chopped, 1 baguette, Kosher salt, Finely grated Parmesan","Preheat oven to 450°. Heat butter and oil in a small saucepan over medium heat. Add garlic and parsley and cook, stirring occasionally, until butter is completely melted., Slice bread in half lengthwise, then place on a baking sheet and brush cut sides with butter mixture., Slice crosswise 1"" thick, without cutting all the way through; season with salt and top with Parmesan. Bake until golden, 10–15 minutes.","[('unsalted butter', 0.5, 'cup'), ('olive oil', 0.25, 'cup'), ('garlic', 2, 'cloves'), ('parsley leaves', None, None), ('baguette', 1, None), ('kosher salt', None, None), ('parmesan', None, None)]"
c71d7a36,https://www.norinesnest.com/traditional-indian-fry-bread/,Traditional Indian Fry Bread,"1 cup all-purpose flour, 1½ teaspoon baking powder, ¼ teaspoon salt, ½ cup plus 2 Tablespoons Milk, Vegetable Oil for Frying","Place flour, baking powder, and salt in a medium bowl. Add milk and stir until dough begins to ball up. On a lightly floured surface knead dough. Do not over-work the dough. After working dough, place in a bowl and chill for 30 minutes., Heat oil to 350 degrees in a deep frying pan or kettle. You'll need at least one inch of oil in the bottom of the pan., Divide the chilled dough into four equal portions. Lightly flour surface. Pat and roll out baseball size pieces of dough to 1/4 inch thickness. Poke a hole in the middle of each disc with your finger or knife (so dough will fry flat). Place dough disc in oil and cook until golden brown, flip over and cook opposite side until golden brown. Dough is done in about 3 minutes depending on oil temperature and thickness of dough., Place fry bread on paper towel lined plate. After fry bread is done top with favorite topping or make Navajo Tacos.","('flour', 1.0, 'cup'), ('baking powder', 1.5, 'teaspoon'), ('salt', 0.25, 'teaspoon'), ('milk', 0.5, 'cup'), ('oil', 2.0, 'tablespoon')"
e9324288,https://therecipecritic.com/homemade-bread/,Grandma's Perfect Homemade Bread,"2 1/2 cup warm water, 1/4 cup sugar, 1 1/4 teaspoon salt, 1 Tablespoon yeast, 5 cups all purpose flour, 2 Tablespoons oil (I used olive oil)","In a stand mixer add the warm water, sugar, salt and yeast. Let the yeast proof until it bubbles for about 5 minutes. Using the dough hook start adding the flour one cup at a time until the dough combines and forms a soft dough., On a floured surface knead the dough until smooth and elastic and form a ball. Add the oil to the large bowl and add the dough to the bowl and cover. Let rise until it has doubled 1- 1 1/2 hours., Grease and flour 2 9x5 inch pans. Punch the dough to release the air. Lay the dough onto a flat surface and cut into two loaves. Roll each loaf up and place into the loaf pans. Let rise until it doubles another 1-1 1/2 hours., Bake in a preheated 350 degree oven for 30-35 minutes or until golden brown on the tops. Remove from the oven and let cool for 10 minutes before slicing.","['water', 2.5, 'cup'], ['sugar', 0.25, 'cup'], ['salt', 1.25, 'teaspoon'], ['yeast', 1.0, 'tablespoon'], ['flour', 5.0, 'cups'], ['oil', 2.0, 'tablespoons']"
e3495217,https://arcticgrub.com/sunnmorsbrod-a-traditional-bread-from-northwestern-norway/,SUNNMØRSBRØD,"1 packet dry fast-rising yeast (about 2 1/2 tsp), About 5 cups lukewarm water, 3 tbsp rapeseed oil (or other vegetable oil), 1 tbsp sugar, 1/4 cup maple syrup or light syrup, 1 tbsp salt, 2 1/4 cup 300 grams whole wheat flour, 2 1/4 cup 300 grams rye flour, 1/2 cup 100 grams old fashioned oats, 8 1/4 cup 1,000 grams all-purpose flour","Pour the yeast, water, rapeseed oil, sugar, and maple syrup into a bowl of a stand mixer and let sit for about 5 minutes until yeast starts to bubble., Meanwhile in a separate bowl, combine the rye and whole wheat flours, oats, and salt. Fit the stand mixer with a dough hook and add the flour mixture to the liquid yeast mixture and combine well., Then add the all-purpose flour and knead the dough for about 10 minutes until you have a smooth dough. Pour the dough onto a clean, lightly floured work surface, divide into three equal pieces and roll out to loaves., Place in three 2 quart loaf pans (or you can just place them in free form on a lightly oiled baking sheet which I did for two of my loaves) cover with a towel and place in a slightly warm area for about 1 hour. You can see the difference in shape/appearance of the loaves baked in a pan and the loaves just placed loosely on a sheet. I kind of prefer the latter, and not a ‘perfect looking’ bread myself., Meanwhile, preheat the oven to 400°F. Brush the top of the loaves with melted vegan butter, and bake for about 45 minutes. Let cool on a rack but not too long—because warm bread with butter is the BEST!!, Freeze any loaves you and your family don’t devour immediately!","[('yeast', 1.0, 'packet'), ('water', 5.0, 'cups'), ('oil', 3.0, 'tbsp'), ('sugar', 1.0, 'tbsp'), ('syrup', 1.0, 'cup'), ('salt', 1.0, 'tbsp'), ('flour', 300.0, 'grams'), ('flour', 300.0, 'grams'), ('oats', 100.0, 'grams'), ('flour', 1000.0, 'grams')]"
