ID,URL,Recipe Name,Ingredients,Instructions,Processed Ingredients
5d78c9d9,https://www.cakenknife.com/mgc-soda-bread/,Traditional Soda Bread,"2 cups all-purpose flour, 2 Tbsp sugar, 1 tsp baking powder, 1 tsp baking soda, 1/4 tsp salt, 3 Tbsp butter, 1/3 cup raisins, 3/4 cup buttermilk","Preheat oven to 375 degrees. Line a baking sheet with a silpat or lightly grease., Combine flour, sugar, baking powder, baking soda, and salt in a large bowl. Using your hands, mix in the butter until the mixture resembles coarse crumbs. Stir in raisins and buttermilk until the dough is evenly combined., Turn dough out onto a clean, lightly floured work surface and knead until smooth, approximately 2 minutes. Shape dough into a ball and place on the baking sheet. Cut a cross on top of the dough, approximately 1/4"" deep., Bake for 30 to 40 minutes, until golden brown.","[('flour', 2.0, 'cups'), ('sugar', 2.0, 'tbsp'), ('baking powder', 1.0, 'tsp'), ('baking soda', 1.0, 'tsp'), ('salt', 0.25, 'tsp'), ('butter', 3.0, 'tbsp'), ('raisins', 1.0, 'cup'), ('buttermilk', 0.33, 'cup')]"
b3d155d9,https://marilenaskitchen.com/easy-whole-wheat-bread/,Easy Homemade Whole Wheat Bread,"1 pkg. active dry yeast (2¼ tsp.), 1 cup warm water (110°F), 2 TBSP. honey, 2 TBSP. extra virgin olive oil, 1¾ cups whole wheat flour (I used Zea flour), 1½ cups all-purpose flour, 1½ tsp. sea salt, 1 med. egg white, beaten, --- coarse sea salt & sesame seeds for topping (optional)","Using a 2-cup glass measuring cup dissolve the yeast in the water. Add the honey. Let stand until foamy, about 6-8 minutes. Stir in the olive oil., In a stand mixer equipped with the dough hook attachment blend the whole-wheat flour, 1¼ cup of the all-purpose flour, and the salt until combined., Pour in the yeast mixture and mix on low speed until the dough forms a ball. The dough should be slightly sticky; if it is too wet, add some of the remaining all-purpose flour, 1 tablespoon at a time (you can also use a food processor, or, just a bowl and a wooden spatula). Empty your dough on a well-oiled bench and knead it until it is not sticky anymore. Shape the dough into a ball and turn it over in a greased bowl. Cover the bowl with plastic wrap and let the dough rise in a warm place until doubled in size, about 1½ hours., After the first rise, punch down the dough to deflate it and knead briefly again on a lightly oiled bench or surface to shape into a smooth, 10-inch-long oblong loaf. Place the dough in a greased 10”x5” loaf pan. Cover loosely with a cloth and let it proof again until almost doubled in size, about 45 minutes to an hour., Preheat oven to 375° F. Brush the top of the bread loaf lightly with the egg white. Sprinkle some sea salt and sesame seeds, if using. With a sharp knife, cut three, ½-inch-deep slashes on top of the loaf. (This slashing is necessary to release some of the trapped gas, which can deform your bread. It also makes the top of your bread look attractive.), Place a small pan (e.g., an 8” cake pan) filled with 1 cup of water in the corner of the lowest shelf in the oven. Slide the bread loaf pan right onto the middle rack of the oven and close the oven door (the steam from the water in the small pan will help to keep the oven moist and allow the bread to rise more, instead of forming a crust right away.), Bake the loaf for about 30 minutes, or, until the top is a deep golden brown (the internal temperature of the bread will be around 190°F). When you remove the loaf from the oven, you will hear it crackle for a while. In baking terms, this is called ""singing"" and it is exactly what you want. Place on a rack and allow it to cool completely before slicing and enjoying. This bread is even better the next day, sliced and toasted, as it brings out the nutty flavor of the whole wheat flour!","[('yeast', 1.0, 'pkg'), ('water', 1.0, 'cup'), ('honey', 2.0, 'tbsp'), ('olive oil', 2.0, 'tbsp'), ('flour', 1.75, 'cups'), ('flour', 1.5, 'cups'), ('salt', 1.5, 'tsp'), ('egg', 1.0, None), ('salt', None, None), ('sesame seeds', None, None)]"
430203bf,http://www.icookstuff.com/en/stafidopsoma-greek-raisin-breads-buns-honey-cinnamon-recipe/,«stafidopsoma» wholesome honey & raisin bread buns,"dough : 310 grams (2 ½ cups) all-purpose flour (or half bread flour and half all-purpose flour optional : 5 grams (2 tsp) malt powder 5 grams (1 tsp) salt 60 ml (¼ cup) milk, warm 10 grams (2 ½ tsp) dry active yeast (or 25 grams fresh yeast) 5 grams (1 tsp) sugar (for yeast mixture) 5 grams (2 tsp) all-purpose flour (for yeast mixture) 60 grams (1 extra large or ¼ cup) egg, beaten 90 grams (¼ cup) thyme honey (or 60 grams - 2½ tbsp honey and 30 grams - 2½ tbsp golden cane sugar) 60 grams (¼ cup) greek yogurt (8%-10% fat content) 60 grams (¼ cup) butter, melted & cooled (45 + 7,5 + 7,5 grams for kneading) marinated raisins : 125 grams (¾ cup) multi-colored raisins 45 ml (3 tbsp) cognac or brandy (or fruit juice) 5 ml (1 tsp) vanilla extract optional : 5 ml (1 tsp) orange blossom water 1,5 grams (¾ tsp) cinnamon powder 1,5 grams (½ tsp) orange zest (or mixed citrus zests) 0,5 gram (¼ tsp) clove powder optional : 0,25 gram (¼ tsp) ground vanilla bean powder egg glaze : 15 grams (1 tbsp) egg yolk 10 ml (2 tsp) milk 10 grams (2 tsp) fine sugar garnish : 10 grams (1 tbsp) rock sugar","combine the ground spices, extracts, zests and cognac and marinate the raisins ideally for 24 hours until almost all the marinade is absorbed and reserve the remaining liquid after straining the raisins (about 1 tbsp or more), warm the milk, mix with some flour and sugar, mix and add the yeast and let sit for at least 15 minutes until frothy, whisk the honey, egg and yogurt until smoother, then add the yeast mixture and whisk again and add the remaining spiced marinade liquid from the raisins, melt the butter and let it cool slightly and set aside, mix the flour, malt powder (if using) and salt and add to the liquid mixture and mix well until shaggy, then press into a ball and let rest for 10-15 minutes, use ¾ of the melted butter (3 tbsp) on your hands and knead the dough for 5 minutes until smooth and elastic, then place in a bowl, cover with plastic film and let rise in a warm space for at least 90 minutes (or up to 120 minutes maximum) until doubled in volume, use only ½ tbsp of the remaining butter to knead the dough again for several minutes and separate into 12 equal balls, then flatten the dough balls and divide the raisins and add them to each balls, then roll up into balls again and use the remaining ½ tbsp butter on your palms to roll them into smooth round balls, *note : if you do not want to add the raisins to the separated smaller balls of dough, you can simply add them to the larger ball of dough and then separate it into smaller balls of dough, it’s simply harder to knead and to distribute the raisins evenly when you do it the first way …, place the balls of dough onto a sheet of baking paper in a large baking dish with a lid (or cover with aluminum foil tightly) and place in a warm space to rise again for at least 45 minutes (or up to 60 minutes maximum) until doubled in size, preheat the oven to 230°C before the last 15 minutes of rising dough, prepare the egg yolk and sugar and milk wash mixture and the rock sugar and set both aside, bake the balls of dough with the lid for 15 minutes maximum, then remove the baking dish from the oven, quickly brush the tops of the hot buns with the egg-milk wash and sprinkle with the rock sugar immediately and bake for an additional 5 minutes maximum, without a lid this time, then remove everything from the oven and let cool down a little and serve, *note : to reheat them, simply place the buns in a hot oven or toaster for a few minutes or spray them with water first and then reheat for an even moister, softer warm bun …, did you like ? share it !, Comments ? Questions ? Send me an email using the contact section below !","[('flour', 310.0, 'grams'), ('malt powder', 5.0, 'grams'), ('salt', 5.0, 'grams'), ('milk', 60.0, 'ml'), ('dry active yeast', 10.0, 'grams'), ('sugar', 5.0, 'grams'), ('egg', 60.0, 'grams'), ('honey', 90.0, 'grams'), ('yogurt', 60.0, 'grams'), ('butter', 60.0, 'grams'), ('raisins', 125.0, 'grams'), ('cognac', 45.0, 'ml'), ('vanilla extract', 5.0, 'ml'), ('cinnamon powder', 1.5, 'grams'), ('orange zest', 1.5, 'grams'), ('clove powder', 0.5, 'gram'), ('egg yolk', 15.0, 'grams'), ('sugar', 10.0, 'grams')]"
65d217c5,https://www.awholesomedish.com/taos-tacos-indian-tacos-2/,Taos Tacos - Indian Tacos,"1 cup unbleached flour (or gluten-free for gluten-free), ¼ teaspoon salt, 1 teaspoon powdered milk or milk, 1 tsp baking powder, ¼ cup lard (Crisco), ½ cup water, Vegetable oil or lard for frying, Extra flour to flour your hands, 1 lb grass fed beef, ½ sweet onion, chopped, 2 cloves garlic, minced, 2 tsp cumin, 2 tsp chili powder, 1 tsp chipotle powder, 1 tsp season salt, 1 tbsp fresh parsley or cilantro, chopped, salt and pepper to taste, 1 cup tomatoes, chopped, 1 cup shredded lettuce, 2 cups shredded cheddar-jack cheese (I used vegan cheddar), Optional: green chiles, black olives, sour cream, or chopped cilantro","Sift together the flour, salt, powdered milk or milk, baking powder, and lard into a large bowl., Pour the water over the flour mixture all at once and stir the dough with a fork until it starts to form one big clump., Flour your hands well., Using your hands, mix the dough, incorporating all the flour into the mixture to form a ball., Mix well, but do NOT knead the dough. Kneading will make the dough heavy when cooked., The inside of the dough ball should still be sticky after it is formed, while the outside will be well floured. Add flour as needed to form into a cylinder., Cut the dough into four (4) pieces., Let dough sit in a warm place for 1 hour. (I put them in the microwave)., While the dough is resting - cook the beef., In a medium-size saucepan over medium heat add the beef, onion, garlic, cumin, chili powder, chipotle powder, season salt, fresh parsley or cilantro, and the salt and pepper., Cook until ground beef is cooked through and set aside., After the dough has rested use your floured hands and shape, stretch, pat, and form a disk of about 5 to 7 inches in diameter. Do not worry about it being round., In a deep heavy cast iron skille t heat the vegetable oil/ lard (Oil should be about 1-inch deep) to about 350 degrees F. (You can check if your oil is ready by dipping the end of a wooden spoon in and seeing if that bubble)., Take the formed dough and gently place it into the oil, being careful not to splatter the hot oil., Press down on the dough as it fries so the top is submerged the hot oil., Fry until brown, and then flip slowly to fry the other side, about 3 to 4 minutes each side, turning every 2 minutes., Place the cooked Fry Bread on a paper towel to absorb excess oil., Add the toppings to your taco, plate and enjoy!","[('flour', 1.0, 'cup'), ('salt', 0.25, 'teaspoon'), ('powdered milk', 1.0, 'teaspoon'), ('baking powder', 1.0, 'tsp'), ('lard', 0.25, 'cup'), ('water', 0.5, 'cup'), ('beef', 1.0, 'lb'), ('onion', 0.5, None), ('garlic', 2.0, 'cloves'), ('cumin', 2.0, 'tsp'), ('chili powder', 2.0, 'tsp'), ('chipotle powder', 1.0, 'tsp'), ('season salt', 1.0, 'tsp'), ('parsley', 1.0, 'tbsp'), ('cilantro', 1.0, 'tbsp'), ('salt', None, None), ('pepper', None, None), ('tomatoes', 1.0, 'cup'), ('lettuce', 1.0, 'cup'), ('cheddar-jack cheese', 2.0, 'cups')]"
254058e6,http://www.feedyoursoul2.com/healthy-gluten-free-bread-loaf/,Wholesome Gluten Free Bread Loaf,"1 1/2 Cups Water, 1 Tbsp Psyllium husk powder, 2 1/2 Tsp Active Yeast, 1/4 Cup Olive Oil, 2 Cups Bob's Red Mill 1 to 1 Gluten Free Baking Flour, 1/2 Cup Buckwheat flour, 1/2 Cup Sorghum flour, 1 1/2 Tsp Xanthan Gum, 4 Tsp Baking Powder, 1 Tsp Salt, 3 Large Egg whites, 3 Tbsp Olive Oil, 1/4 - 1/2 Cup Extra thick GL rolled oats","Yeast Mix, In measuring cup, pour in water 110 degree water and add the honey, psyllium husk powder and the Yeast. Set-aside & let bloom for approximately ten minutes., Building the Gluten Free Bread, Meanwhile, combine the dry ingredients (save for the oats) in large bowl and mix well. Combine the yeast mixture into the bowl. Using a hand mixer, mix until just combined. Once absorbed, add the egg whites and beat on medium-high for approximately 3 minutes. Add in most of the oats in the last 30 seconds. The dough will be wet and a tacky. Spray the loaf pan with non-stick spray. Pour the dough into the loaf pan. Add the remaining oats on the top of the bread. Note, that you want the mixture to come up about 3/4 to a little higher in the loaf pan. Find a warm spot in your kitchen and let the loaf proof until it gets to just below the bottom of the loaf pan. This will take anywhere from one to three hours. You do not want to let the proof rise above the loaf pan or your bread will like fall during baking.In a pre-heated 375 degree oven, add the bread on a middle shelf. Bake for approx. 35 -45 minutes. If the crust is darkening too quickly, you can cover it with foil and return to baking until done. You do need to watch the bread. The best way to know when it is done is to check with a thermometer. You are looking for approximately 210 degrees. When the bread is complete, remove from the oven and after a few minutes, take the bread out and place on a wire rack. Unlike gluten breads, it is best to let the bread cool completely before cutting.Serve and enjoy!","[('water', 1.5, 'cups'), ('psyllium husk powder', 1.0, 'tbsp'), ('active yeast', 2.5, 'tsp'), ('olive oil', 0.25, 'cup'), ('gluten free baking flour', 2.0, 'cups'), ('buckwheat flour', 0.5, 'cup'), ('sorghum flour', 0.5, 'cup'), ('xanthan gum', 1.5, 'tsp'), ('baking powder', 4.0, 'tsp'), ('salt', 1.0, 'tsp'), ('egg whites', 3.0, None), ('olive oil', 3.0, 'tbsp'), ('extra thick gl rolled oats', 0.25, 'to 0.5 cup')]"
9eef1640,https://goodcheapeats.com/wholesome-energy-bars/,Wholesome Energy Bars,"1 cup milk, 3 tbsp olive oil, 3 tbsp honey, 1 tsp vanilla extract, 1 cup whole-wheat flour, 2 cup unbleached, all-purpose flour, 1/2 cup oat flour, 1/4 cup cornmeal, 1 tbsp orange zest ((from 1 orange)), 1 tsp ground cinnamon, 2 1/4 tsp active dry yeast, 1 tsp salt, 1/4 cup dried cranberries, 1/4 cup golden raisins, 1/4 cup raisins, 1/4 cup sunflower seeds","Combine all of the ingredients in your bread machine according to the manufacturer’s instructions. Program the machine for the dough setting and start it., Grease a baking sheet. When the cycle is complete, turn the dough out onto a lightly floured surface. Press the dough into a 1-inch-thick rectangle. Cut into 12 rectangles and place them on the prepared baking sheet., Preheat the oven to 350°F. Allow the bars to rise for about 20 minutes., Bake the bars for 20 minutes, or until golden brown. Cool the bars on a rack., Freezing instructions: Place the cooled bars in the freezer bag and seal, removing as much air as possible. Freeze., To thaw and serve: Thaw the desired number of bars at room temperature. Serve at room temperature, or cut the bars in half horizontally, toast, and serve with butter.","[('milk', 1.0, 'cup'), ('olive oil', 3.0, 'tbsp'), ('honey', 3.0, 'tbsp'), ('vanilla extract', 1.0, 'tsp'), ('whole-wheat flour', 1.0, 'cup'), ('unbleached, all-purpose flour', 2.0, 'cup'), ('oat flour', 0.5, 'cup'), ('cornmeal', 0.25, 'cup'), ('orange zest', 1.0, 'tbsp'), ('ground cinnamon', 1.0, 'tsp'), ('active dry yeast', 2.25, 'tsp'), ('salt', 1.0, 'tsp'), ('dried cranberries', 0.25, 'cup'), ('golden raisins', 0.25, 'cup'), ('raisins', 0.25, 'cup'), ('sunflower seeds', 0.25, 'cup')]"
d6d2bfde,https://www.vegetariantimes.com/recipes/wholesome-wheat-bread/,Wholesome Wheat Bread,"3 cups warm water, 3 Tbs. dry yeast, 1/3 cup honey, 3 Tbs. canola oil, 6 to 6 1/2 cups unsifted whole wheat flour, 1 Tbs. salt, 1 cup nonfat milk powder, 4 Tbs. margarine, melted"," Mix water, yeast, honey and oil in large bowl. Sift together 6 cups flour, salt and milk powder; stir into yeast mixture. Add remaining 1?2 cup flour if dough is too sticky. Cover bowl, and let sit in warm place 15 minutes. Preheat oven to 350F. Spray two 9×5-inch loaf pans with nonstick cooking spray. Dust work surface with flour, turn out dough and knead well 10 minutes, adding extra flour if it becomes sticky. Form into 2 loaves, and place in loaf pans. Let rise in warm place 15 minutes.  Bake 50 to 55 minutes, or until golden. (After 40 minutes, check to see if crust is golden enough; if so, cover loaves with foil to prevent over-darkening.) Remove from pans, brush tops with melted margarine and cool on racks. ALSO PER SERVING: 73mg calcium; 2mg iron; 30 IU vitamin d; 0.2mcg vitamin b12; 2mg zinc","[('water', 3.0, 'cups'), ('yeast', 3.0, 'tbs.'), ('honey', 1.0, 'cup'), ('oil', 3.0, 'tbs.'), ('flour', 6.0, 'cups'), ('salt', 1.0, 'tbs.'), ('milk powder', 1.0, 'cup'), ('margarine', 4.0, 'tbs.')]"
968d1bb7,https://cookieandkate.com/healthy-pumpkin-bread-recipe/,Healthy Pumpkin Bread,"1/3 cup melted coconut oil or extra-virgin olive oil*, 1/2 cup honey or maple syrup, 2 eggs, 1 cup pumpkin purée, 1/4 cup milk of choice or water, 1 1/2 teaspoons pumpkin spice blend (or 1/2 teaspoon cinnamon, 1/2 teaspoon ground ginger, 1/4 teaspoon ground nutmeg, and 1/4 teaspoon allspice or cloves), 1 teaspoon baking soda (NOT baking powder; they aren’t the same!), 1 teaspoon vanilla extract, 1/2 teaspoon salt, 1 3/4 cups white whole wheat flour or regular whole wheat flour, Totally optional: 1/2 cup mix-ins like chopped walnuts or pecans, chocolate chips, raisins, chopped dried fruit…, Pinch of ground cinnamon, for sprinkling on top","Preheat oven to 325 degrees Fahrenheit (165 degrees Celsius) and grease a 9×5-inch loaf pan., In a large bowl, beat the oil and honey together together with a whisk. Add the eggs and whisk until blended. (If your coconut oil solidifies on contact with cold ingredients, simply let the bowl rest in a warm place for a few minutes, like on top of your stove, or warm it for about 10 seconds in the microwave.), Add the pumpkin purée, milk, pumpkin spice, baking soda, vanilla and salt, and whisk to blend. Lastly, switch to a big spoon and stir in the flour, just until combined. Some lumps are ok! If you’re adding any additional mix-ins, gently fold them in now., Pour the batter into your greased loaf pan and sprinkle lightly with cinnamon. If you’d like a pretty swirled effect, run the tip of a knife across the batter in a zig-zag pattern., Bake for 55 to 60 minutes, or until a toothpick inserted into the center comes out clean (typically, if I haven’t added any mix-ins, my bread is done at 55 minutes; if I have added mix-ins, it needs closer to 60 minutes). Let the bread cool in the loaf pan for 10 minutes, then carefully transfer the bread to a cooling rack to cool for 20 minutes before slicing.","[('coconut oil', 0.33, 'cup'), ('olive oil', 0.33, 'cup'), ('honey', 0.5, 'cup'), ('maple syrup', 0.5, 'cup'), ('eggs', 2, None), ('pumpkin purée', 1, 'cup'), ('milk', 0.25, 'cup'), ('pumpkin spice blend', 1.5, 'teaspoons'), ('cinnamon', 0.5, 'teaspoon'), ('ginger', 0.5, 'teaspoon'), ('nutmeg', 0.25, 'teaspoon'), ('allspice', 0.25, 'teaspoon'), ('cloves', 0.25, 'teaspoon'), ('baking soda', 1, 'teaspoon'), ('vanilla extract', 1, 'teaspoon'), ('salt', 0.5, 'teaspoon'), ('white whole wheat flour', 1.75, 'cups'), ('walnuts', 0.5, 'cup'), ('pecans', 0.5, 'cup'), ('chocolate chips', 0.5, 'cup'), ('raisins', 0.5, 'cup'), ('dried fruit', 0.5, 'cup'), ('cinnamon', 1, 'pinch')]"
d5d57b8e,https://fooddoodles.com/whole-wheat-mountain-bread/,Whole Wheat Mountain Bread,"1 cup cold water, 1/2 cup cornmeal, 1 1/2 cups boiling water, 1 1/4 tablespoons active dry yeast, 1/2 cup honey or molasses (or a combination of both), 1/2 cup warm water, 3/4 cup dry buttermilk powder, 1/2 cup wheat bran, 2 cups whole wheat flour, 1/3 cup olive oil, 2 tablespoon sesame seeds, 1 cup whole wheat flour, 3 - 31/2 cups bread flour","Whisk together the cold water and cornmeal. Let sit for 5 minutes then add the boiling water and whisk together. Let stand 10 minutes. Sprinkle yeast over the 1/2 c water with 1 tsp honey or molasses in a separate bowl. Let stand 5 minutes. Add buttermilk powder(I haven't been able to find this so I just used milk powder and added a tbsp of vinegar), remaining honey or molasses(I used about 1 tbsp honey and the rest regular baking molasses), wheat bran, and whole wheat flour to the cornmeal and water along with the softened yeast. Mix well and set aside, covered, for one hour. It will double., Sprinkle oil, salt, and sesame seeds over sponge and mix in. Add bread flour 1/2 c at a time till a soft dough forms. Turn out and knead till smooth, about 2-4 minutes. Don't add too much flour as the dough should be sticky. I found it to be very sticky, but the end result is very good, so don't aim for dough that isn't sticky. It will be considerable less sticky after it rises. Coat with oil and leave dough 2 1/2 - 3 hours till doubled. Turn out and divide into 4. Roll into tight round balls(you may need to use a little flour or else it will stick to your surface and your hands) and place 4"" apart on parchment lined sheets sprinkled with cornmeal. Sprinkle the tops of the loaves with wheat bran, the cover with a towel and let rise about 45 minutes., Preheat your oven to 400 degrees. If you can, gently tuck the sides of the loaves underneath itself to make higher loaves, but be very careful not to deflate them. I usually place a dish of water in the bottom of the oven when I turn it on to make it steamy inside. This will help the bread spring up in the first few minutes of baking. Put loaves in the oven and bake 10 minutes then turn the oven down to 350 degrees and bake for 25-30 minutes till done. You may need to loosely cover the loaves in a piece of tin foil to prevent them from over browning near the end of baking.","[('water', 1.0, 'cup'), ('cornmeal', 0.5, 'cup'), ('active dry yeast', 1.25, 'tablespoon'), ('honey', 0.5, 'cup'), ('molasses', 0.5, 'cup'), ('water', 0.5, 'cup'), ('buttermilk powder', 0.75, 'cup'), ('wheat bran', 0.5, 'cup'), ('whole wheat flour', 2.0, 'cups'), ('olive oil', 0.33, 'cup'), ('sesame seeds', 2.0, 'tablespoons'), ('whole wheat flour', 1.0, 'cup'), ('bread flour', 3.0, 'cups')]"
e74e91e3,https://www.crazy-cucumber.com/wholesome-seeded-banana-bread-with-tahini-and-olive-oil-dairy-free-recipe/,Wholesome Seeded Banana Bread with Tahini and Olive oil,"1 cup all purpose flour, 1/2 cup spelt flour, 2 teaspoons baking powder, 1/4 teaspoon fine salt, 2 Tbs toasted sesame seeds, 2 Tbs poppy seeds, 2 Tbs hemp seeds, 2 eggs, 2/3 cup sugar (I use brown sugar and coconut sugar in ratio 1:1), 1/2 cup olive oil, 1 Tbs tahini, 1 Tbs molasses, 1 teaspoon vanilla extract, 1 cup mashed banana with little chunks (I use two large overripe bananas), 1/2 cup toasted, chopped walnuts (optional), one small banana cut lengthwise (for decoration), 1 Tbs toasted sesame seeds (for decoration)","Preheat the oven to 180С (350F). Line high 10x18cm loaf pan with baking paper., In a large bowl whisk together the flour, baking powder, salt and seeds.In another bowl whisk together the oil, eggs, sugar, vanilla extract, molasses and tahini. Gently mix in the mashed banana with little chunks. Add the wet mix to the dry mix whisking until combined. Fold in toasted chopped walnuts., Pour batter into the prepared loaf pan, arrange banana slices on top of batter. Sprinkle with the toasted sesame seeds., Bake for about 60 -70 minutes or until a skewer comes out clean. Let it cool for at least 7 minutes before you remove it from the pan, then chill completely before the cut. Enjoy!","[('flour', 1.0, 'cup'), ('flour', 0.5, 'cup'), ('baking powder', 2.0, 'teaspoons'), ('salt', 0.25, 'teaspoon'), ('sesame seeds', 2.0, 'tbs'), ('poppy seeds', 2.0, 'tbs'), ('hemp seeds', 2.0, 'tbs'), ('eggs', 2.0, None), ('sugar', 0.67, 'cup'), ('olive oil', 0.5, 'cup'), ('tahini', 1.0, 'tbs'), ('molasses', 1.0, 'tbs'), ('vanilla extract', 1.0, 'teaspoon'), ('banana', 1.0, 'cup'), ('walnuts', 0.5, 'cup'), ('banana', 1.0, None), ('sesame seeds', 1.0, 'tbs')]"
