ID,URL,Recipe Name,Ingredients,Instructions,Processed Ingredients
2a282ce1,https://www.dimitrasdishes.com/the-best-homemade-bread-recipe/,THE BEST HOMEMADE BREAD RECIPE,"1 and 1/2 teaspoons dry active yeast, 2 teaspoons sugar, 1 and 1/2 cups tepid water, 2 cups all purpose flour, 2 cups bread flour, 1 teaspoon salt, 1/4 cup olive oil, Sesame seeds (optional)","This bread really is outa of this world delicious. You MUST try it once!, Begin by proofing the yeast. Combine the yeast, water, and sugar and mix. Set aside about 8 minutes until the yeast is activated. It is ready when a puffy cloud forms over the water. Your yeast is good and ready!, Combine the flour with the salt in the bowl of a tabletop mixer and mix the ingredients to combine. Add the yeast mixture and the olive oil. With the dough hook attachment, knead on low speed for 7-8 minutes., This can also be done in a large bowl by hand. The kneading time will increase to 10-12 minutes or until the dough is soft and smooth., Place the dough in an oiled bowl covered with a kitchen towel or with plastic wrap. Set aside to rise until doubled in size. This takes about 45 minutes to 1 hour. It may take longer if it is cold in your home., Preheat oven to 500 degrees Fahrenheit, 260 degrees Celsius., Tip: If you have a cast iron pan and a pizza stone place the cast iron pan on the lowest rack of your oven and the pizza stone in the middle rack. Place them in the oven while the oven is cold so that the pizza stone does not crack. Let them warm while the oven is preheating. Doing this will help you create bakery style bread rings. Crusty on the outside and soft on the inside., Punch the dough down and form into a ball. You may also form it into a baguette. I prefer the round shape., Place the formed dough onto a half sheet pan lined with parchment paper and cover with a clean towel. Set aside to rise about 30 minutes. It will almost double in size., Brush the top of the dough with water. Make 4 decorative slices on top and sprinkle with sesame seeds if desired., To create a nice crusty top, pour 1 cup of ice water in the cast iron pan to create steam. Place the baking tray with the dough on it on the middle oven rack. Reduce the oven temperature to 450 degrees Fahrenheit, 232 degrees Celsius. Let it bake for 30 minutes., Remove the bread from the pan and place directly onto the pizza stone and bake 5 more minutes. This will make the bread have an extra crispy crust., Allow the bread to rest at room temperature at least 30 minutes before slicing. This will allow the steam to distribute throughout the bread and create a very moist interior., Warm the bread in the oven for 5 minutes before slicing., Enjoy!","[('yeast', 1.5, 'teaspoons'), ('sugar', 2.0, 'teaspoons'), ('water', 1.5, 'cups'), ('flour', 2.0, 'cups'), ('flour', 2.0, 'cups'), ('salt', 1.0, 'teaspoons'), ('oil', 0.25, 'cups')]"
0914d315,https://www.inspiredtaste.net/19313/easy-focaccia-bread-recipe-with-herbs/,Easy Homemade Focaccia Bread,"1/2 cup (120ml) extra-virgin olive oil, 2 garlic cloves, finely minced, 1 tablespoon chopped fresh rosemary or 1 teaspoon dried, 1 tablespoon chopped fresh thyme or 1 teaspoon dried, 1/4 teaspoon fresh ground black pepper, 1 cup (235ml) lukewarm water (110°F to 115°F), 2 ¼ teaspoons instant yeast, one 1/4-ounce packet, 1/4 teaspoon sugar, honey, or maple syrup, 2 ½ cups (325g) all-purpose flour, 1 teaspoon fine sea salt","Combine olive oil, minced garlic, thyme, rosemary, and black pepper in a cold medium skillet. Place the pan over low heat and cook, stirring occasionally, for 5 to 10 minutes or until aromatic. You are not looking to add color to the garlic. Keep the temperature low and remove the skillet from the heat before the garlic browns. Set aside and allow to cool., In a large bowl, combine the warm water, yeast, and sugar. Stir a few times, then let it sit for 5 minutes., Add 1 cup of the flour and 1/4 cup of the infused garlic-olive oil mixture to the bowl with yeast. Stir 3 to 4 times until the flour has moistened. Let sit for another 5 minutes., Stir in the remaining 1 ½ cups of flour and the salt. When the dough comes together, transfer it to a floured board and knead 10 to 15 times until smooth (see video for reference)., Transfer the dough to a large oiled bowl, cover with a warm, damp towel, and let it rise at room temperature until doubled in size, for 1 to 2 hours., When the dough has doubled in size, preheat the oven to 450°F (232°C)., Use two tablespoons of the remaining garlic-olive oil mixture to oil a 9 x 13-inch rimmed baking sheet. See the tips below for other pan sizes., Transfer the dough to the baking sheet, then gently press it into the pan. Use your fingers to dimple the dough, then drizzle the top with the remaining garlic-olive oil mixture. Let the dough rise for 20 to 30 minutes until it puffs slightly., Bake until golden brown, 15 to 20 minutes, and then let the baked focaccia bread cool completely on a wire rack.","[('olive oil', 0.5, 'cup'), ('garlic', 2.0, None), ('rosemary', 1.0, 'tablespoon'), ('thyme', 1.0, 'tablespoon'), ('black pepper', 0.25, 'teaspoon'), ('water', 1.0, 'cup'), ('yeast', 2.25, 'teaspoon'), ('sugar', 0.25, 'teaspoon'), ('flour', 2.5, 'cups'), ('salt', 1.0, 'teaspoon')]"
a740230e,https://www.gimmesomeoven.com/rosemary-focaccia-bread/,Rosemary Focaccia Bread,"1 1/3 cup warm water (about 110°F), 2 teaspoons sugar or honey, 1 (0.25 ounce) package active-dry yeast, 3 1/2 cups all purpose flour, 1/4 cup extra virgin olive oil, plus more for drizzling, 2 teaspoons flaky sea salt, plus extra for sprinkling*, 2 sprigs fresh rosemary","Proof the yeast, Add warm water (about 110°F, which you can measure with a thermometer if you want to be sure it’s the right temp) and sugar to the bowl of a stand mixer with the dough attachment, and stir to combine. Sprinkle the yeast on top of the water. Give the yeast a quick stir to mix it in with the water. Then let it sit for 5-10 minute until the yeast is foamy., Knead the dough., (See alterate instructions below to knead by hand.) Set the mixer to low speed, and add gradually flour, olive oil and salt. Increase speed to medium-low, and continue mixing the dough for 5 minutes. (If the dough is too sticky and isn’t pulling away from the sides of the bowl, add in an extra 1/4 cup flour while it is mixing.), First dough rise, Remove dough from the mixing bowl, and use your hands to shape it into a ball. Grease the mixing bowl (or a separate bowl) with olive oil or cooking spray, then place the dough ball back in the bowl and cover it with a damp towel. Place in a warm location (I set mine by a sunny window) and let the dough rise for 45-60 minutes, or until it has nearly doubled in size., Second dough rise, Turn the dough onto a floured surface, and roll it out into a large circle or rectangle until that the dough is about 1/2-inch thick*. Cover the dough again with the damp towel, and let the dough continue to rise for another 20 minutes., Prepare the dough, Preheat oven to 400°F. Transfer the dough to a large parchment-covered baking sheet (or press it into a 9 x 13-inch baking dish). Use your fingers to poke deep dents (seriously, poke all the way down to the baking sheet!) all over the surface of the dough. Drizzle a tablespoon or two of olive oil evenly all over the top of the dough, and sprinkle evenly with the fresh rosemary needles and sea salt., Bake for 20 minutes, or until the dough is slightly golden and cooked through., Serve, Remove from the oven, and drizzle with a little more olive oil if desired. Slice, and serve warm.","[('water', 1.0, 'cup'), ('sugar', 2.0, 'teaspoons'), ('yeast', 1.0, 'package'), ('flour', 3.5, 'cups'), ('olive oil', 0.25, 'cup'), ('salt', 2.0, 'teaspoons'), ('rosemary', 2.0, 'sprigs')]"
adb73f5c,https://www.blessthismessplease.com/homemade-subway-bread-recipe/,Homemade Subway Bread Recipe,"1 cup warm water ((110 degrees F)), 1 tablespoon instant yeast, 1 tablespoon sugar, 1 1/2 teaspoon salt, 4 tablespoons olive oil, 2 1/2 to 2 3/4 cups all-purpose flour","In the bowl of your stand mixer, add the water, yeast, sugar, salt, and olive oil. Let the mixture stand for 5 minutes., Add 1 cup of flour and mix with the dough hook for 3 to 5 minutes. Add an additional cup of flour and mix until well combined. Continue adding the flour, 1/4 cup at a time, until a soft dough is formed. The dough should still stick to the bottom of of the bowl, but pull away from the sides. Let the dough mix for around 8 minutes total., When the dough has come together but is still sticking a bit to the bottom of the bowl, turn it out onto a lightly floured surface and knead until smooth. The dough should be very soft. Shape the dough into a ball and return it to the bowl. Cover the bowl with plastic wrap and allow the dough to rise for a half hour., After the dough has risen, turn it out onto a clean surface and divide it into 4. Roll each piece of dough into a long skinny loaf that is about 9 to 10 inches long., Place the rolled loaves onto a baking sheet lined with parchment or a baking mat. Repeat with the rest of the dough. Allow at least 2 inches between each loaf on the pan., Cover the loaves with a greased piece of plastic wrap and allow the loaves to rise until doubled, about an hour., Towards the end of the rising time, preheat the oven to 350 degrees. When the loaves are ready, bake them in the preheated oven for 25 minutes., When the loaves come out of the oven, rub the tops with a stick of butter and cover them with a dish towel to cool., Let the loaves cool for at least 30 minutes before cutting down the middle and topping with your favorite sandwich fixings.","[('water', 1.0, 'cup'), ('yeast', 1.0, 'tablespoon'), ('sugar', 1.0, 'tablespoon'), ('salt', 1.5, 'teaspoon'), ('olive oil', 4.0, 'tablespoon'), ('flour', 2.5, 'cup')]"
384996b9,https://damndelicious.net/2017/12/05/no-knead-rosemary-bread/,No Knead Rosemary Bread,"3 cups all-purpose flour, 3 cloves garlic (minced), 1 tablespoon finely chopped fresh rosemary (or more, to taste), 1 1/4 teaspoons kosher salt, 3/4 teaspoon freshly ground black pepper, 1/2 teaspoon instant yeast, 1 1/2 cups water (at room temperature), 2 tablespoons cornmeal","In a large bowl, combine flour, garlic, rosemary, salt, pepper and yeast., Using a wooden spoon or your hand, add water and mix until a wet, sticky dough forms, about 30 seconds., Cover bowl tightly with plastic wrap and let stand at room temperature until surface is dotted with bubbles, about 18 to 24 hours., Lightly oil a 10-inch cast iron skillet or coat with nonstick spray; sprinkle with cornmeal., Working on a lightly floured surface, gently shape dough into a round., Place dough into the prepared skillet. Cover with a clean dishtowel and let stand at room temperature until dough has doubled in size and does not readily spring back when poked with a finger, about 2 hours., Preheat oven to 450 degrees F. Place into oven and bake until golden brown, about 30-40 minutes., Serve warm.","[('flour', 3.0, 'cups'), ('garlic', 3.0, 'cloves'), ('rosemary', 1.0, 'tablespoon'), ('kosher salt', 1.25, 'teaspoons'), ('black pepper', 0.75, 'teaspoon'), ('yeast', 0.5, 'teaspoon'), ('water', 1.5, 'cups'), ('cornmeal', 2.0, 'tablespoons')]"
381a3ca0,https://smithfarm1914.com/homemade-bread/,Homemade Bread,"2 cups Warm Water, 1 TBSP Active Yeast, 2 tsp salt, 2 TBSP softened butter, 1/4 cup honey, 4-5 cup bread flour","Combine yeast and water (105-115 degrees) rest 10 minutes until bloomed, In a large bowl add 3 cups flour, salt, butter, honey add bloomed yeast mix. Mix to combine., Add remaining flour 1/2 cup at a time. Once bread is tacky but not stick to your hands, you can pull bread from bowl easily, knead for 10 minutes, Grease bowl, turn over once allow to rise 1.5 hours or doubled in size., Punch down and divide dough into two loaves, Allow to rise until doubled in size (about 30 minutes) place in oven at 350 degrees and bake for 33-35 minutes. Or until tops are golden brown. Take out of loaf our of pans once cooked and rub with butter. Allow at least 20 minutes of cooling time before cutting and enjoy!","[('water', 2.0, 'cups'), ('yeast', 1.0, 'tbsp'), ('salt', 2.0, 'tsp'), ('butter', 2.0, 'tbsp'), ('honey', 0.25, 'cup'), ('bread flour', 4.0, 'cup')]"
44f6ba1f,https://www.browneyedbaker.com/white-bread-recipe/,My Favorite White Bread Recipe,"4½ teaspoons instant yeast (two 0.25-ounce packets), ¾ cup + 2⅔ cups warm water (divided), ¼ cup granulated sugar, 1 tablespoon salt, 3 tablespoons unsalted butter, cubed, at room temperature, 9 to 10 cups all-purpose flour, 3 tablespoons unsalted butter (melted, for brushing)","In the bowl of a mixer, stir to dissolve the yeast in ¾ cup (180ml) of the warm water, and let sit for 5 minutes. Add the remaining 2⅔ cups (640ml) water, sugar, salt, room temperature butter, and 5 cups of the flour and stir to combine., Using a dough hook, mix on low speed and gradually add the remaining flour until the dough is soft and tacky, but not sticky (you may not need to use all of the flour). Continue to knead until a soft ball of dough forms and clears the sides of the bowl, about 7 to 10 minutes., Place the dough in a lightly greased bowl and turn it over so it is completely coated. Cover with plastic wrap and set in a draft-free place to rise until doubled in size, about 45 minutes to 1 hour., Turn the dough out onto a clean, lightly floured surface. Gently press it all over to remove any air pockets. Divide the dough in two and, working with one piece at a time, gently pat it into a 9x12-inch rectangle. Roll up the rectangle, starting on the short end, into a very tight cylinder. Pinch to seal the seams and the ends, tuck the ends of the roll until the bread, and place into greased 9-inch loaf pans. Cover the loaves loosely and place in a draft-free area until doubled in size, 30 to 45 minutes., Position an oven rack on the lowest setting and preheat the oven to 400 degrees F., Brush the loaves with some of the melted butter. Bake the loaves for 30 to 35 minutes, rotating halfway through, until golden brown (an instant-read thermometer inserted into the center should read 195 degrees F)., Remove from the oven and immediately brush with more of the melted butter. Allow to cool for 10 minutes, then remove from the pans and cool completely before slicing. The bread can be stored in an airtight bread bag or wrapped tightly in plastic wrap at room temperature for up to 4 days. It can also be frozen for up to 1 month.","[('yeast', 4.5, 'teaspoons'), ('water', 0.75, 'cup'), ('water', 2.67, 'cups'), ('sugar', 0.25, 'cup'), ('salt', 1.0, 'tablespoon'), ('butter', 3.0, 'tablespoons'), ('flour', 9.0, 'cups'), ('butter', 3.0, 'tablespoons')]"
1df0dc07,https://cosmopolitancornbread.com/basic-homemade-bread/,Homemade Honey Wheat Bread,"2 eggs, 2 c + 2 Tb warm water, 1 Tb sea salt, 3 Tb olive oil (or vegetable), 4 1/2 teaspoon yeast, 6 1/2 c flour, 1/2 c honey","To begin, grease & flour 4 4x9"" loaf pans (or coat with my baking spray replacement.), Combine all ingredients except 1/2 cup of the flour in the mixing bowl and run the mixer with the dough hook attachment, on low, for 14 minutes., Add small amounts of the reserved flour if the dough is sticky., Cover the bowl and let the dough rise, covered, in a warm place for 45 minutes, or until it is doubled in size., Turn the dough out onto a floured surface., Divide the dough into 4 equal portions and pat out a portion into a rectangle. Roll the dough up and place in a prepared loaf pan, seam-side down, and tucking the ends under., Repeat this with all of the portions. Cover the loaves with a tea towel and let them rise in a warm place for about an hour, or until the loaves have doubled in size., Heat your oven to 350 degrees., Brush the tops of the loaves with a little milk., Bake for 18 minutes., Remove the loaves from the pans and let them cool on baking racks., Enjoy!","[('eggs', 2.0, None), ('water', 2.0, 'c'), ('sea salt', 1.0, 'tb'), ('olive oil', 3.0, 'tb'), ('yeast', 4.0, 'teaspoon'), ('flour', 6.0, 'c'), ('honey', 0.5, 'c')]"
37539998,https://wanderzestblog.com/homemade-pita-bread/,Homemade Pita Bread,"1 cup warm water, 2 1/4 tsp active dry yeast, 2 1/2 cups all-purpose flour, 2 tsp salt, 1 Tbsp olive oil, parsley, optional, garlic powder, optional, olive oil, for serving, optional","Mix the water and yeast together in the bowl of a stand mixer. Let sit until the yeast is dissolved, about 5 minutes. Attach the dough hook. Add in the flour, salt, and olive oil. Mix the dough on medium speed for 8 minutes. The bread can also be kneaded by hand on a floured surface for 5-7 minutes or until smooth., Lightly oil the bowl before covering with plastic wrap. Let the dough rise until doubled in size, about 1 hour. Once risen, turn the dough onto a floured surface. Divide the dough into 8 pieces, rolling each piece into an 8-inch circle. Add extra flour if the dough starts to stick to the counter. If the dough starts to spring back after rolling, allow dough to rest for up to 30 minutes before cooking., Place a cast iron skillet on medium-high heat. Drizzle a little bit of olive oil in the skillet. Add a pita to the skillet and cook for 1 minute or until you see bubbles start to form. Flip and cook the other side for another 1-2 minutes until the underside starts to brown. Continue this method of cooking each of the pitas., Serve fresh pita with a dash of garlic powder, sprinkle of parsley, and drizzle of olive oil, if desired. Pita bread can be stored in an airtight container for 5-7 days.","[('water', 1.0, 'cup'), ('yeast', 2.0, 'tsp'), ('flour', 2.5, 'cups'), ('salt', 2.0, 'tsp'), ('olive oil', 1.0, 'tbsp')]"
a063f8a9,https://www.bowlofdelicious.com/dutch-oven-bread/,Dutch Oven No Knead Crusty Bread,"1 1/2 cups warm water ((about 100 degrees F)), 1 packet yeast ((active dry, instant, or quick rise- 2.25 teaspoons)), 1/2 tablespoon fine grain salt ((preferably NOT iodized, see notes)), 3 1/4 cups all-purpose flour","Mix the water, yeast, and salt., In a large bowl (or container), mix together the warm water (1.5 cups), yeast (1 packet/2.25 teaspoons), and table salt (1/2 tablespoon), until yeast and salt are fully or almost dissolved (I like using a whisk for this)., Add the flour (3.25 cups) to the bowl all at once and stir together until a sticky dough forms. Don't worry about mixing it too much, just make sure everything is uniformly wet. It WILL be messy and sticky. You can scrape what's left on the spoon with a silicone spatula. (photo below provided for what the texture should look like - if it seems too wet, add 1-2 tablespoons more flour at a time until it is more like the photo. If it seems too dry, do the same thing with more water)., Allow to rise in a warm place., Cover the bowl with a kitchen towel (or place the container to the lid on ajar). Leave it for 2-3 hours to rise in a somewhat warm place until it's doubled in volume, like photo in previous step (If it's cold out, I like to preheat my oven for a few minutes, then turn it off, then place the bowl in the oven, trapping the heat inside. If your house is warm just leave it out, or if it's warm outside you can place it there)., Bake or refrigerate., After the two-three hour rise time when the dough has about doubled, you have two options: bake, or store in the fridge. See notes for how to store., Preheat the Dutch oven., 30 minutes to an hour before you are ready to bake, preheat your oven to 450 degrees F. Place your Dutch oven in the oven, with the lid ON, while the oven is preheating. Once the oven reaches 450, keep it preheating for another 20 minutes, so the Dutch oven gets good and hot., Flour parchment paper and add dough., Scrape the dough into the edge of a piece of parchment paper dusted with flour. Make it into as much of a ""loaf"" shape as you can by folding the edges up on top of it (a silicone spatula works well for this)., Shape the loaf., Then, use the edges of the parchment paper to flip the loaf over so the floured side is on top and the loaf is in the center of the parchment paper. Don't worry about it looking beautiful or smooth on top. My Dutch oven is an oval, so I made an oval shape. You can do a circle if yours is round., Score the loaf., Optional: use a very sharp knife or clean razor blade to cut a few slits across the top of the loaf about 1/2"" deep, across the entire top. I did this in a cross shape for mine., Place loaf in hot Dutch oven carefully., Take out the preheated Dutch oven and take off the lid, carefully! Grab the parchment from the sides and place the loaf in your Dutch oven., Bake., Place the cover back on the Dutch oven and place in the preheated oven on the center rack. Bake for 35 minutes at 450 degrees F (40 minutes if dough was cold from the fridge). Remove the lid and bake for another 5-10 minutes, until a golden brown color forms- longer if necessary. Remove the loaf from the dutch oven (grabbing the sides of the parchment paper works well here) and place it on a wire rack or cutting board to cool for at least 10 minutes (preferably 30 minutes - an hour, if you have time) before slicing.","[('water', 1.5, 'cups'), ('yeast', 1.0, 'packet'), ('salt', 0.5, 'tablespoon'), ('flour', 3.25, 'cups')]"
bfba7898,https://thecafesucrefarine.com/best-ever-homemade-flour-tortillas/,Best Ever Homemade Flour Tortillas,"3 cups all-purpose flour, 1 teaspoon kosher salt (I use Morton's), 1 teaspoon baking powder, ⅓ cup extra virgin olive oil, vegetable oil or other fairly neutral flavored oil, 1 cup warm water","To make by hand:, Combine flour, salt and baking powder in a medium-size bowl. Using a sturdy silicone spatuala or a sturdy wooden spoon, mix dry ingredients until well combined., Make a well in the center of the dry ingredients and add the oil and water. Stir well from the bottom up, until all dry ingredients are incorporated and the dough begins to come together and form a shaggy ball., Turn dough out onto a lightly floured work surface and knead for 1-2 minutes until the dough is nice and smooth. Proceed with step number 3 below for the remainder of the recipe., To make with a mixer:, Combine flour, salt and baking powder in the bowl of a stand mixer. Using the dough hook, mix dry ingredients until well combined., Add oil and water with mixer running at a medium speed. After about 1 minute, or when mixture comes together and begins to form a ball, decrease mixing speed to low. Continue to mix for 1 minute or until dough is smooth., Transfer dough to a lightly floured work surface. Divide into 16 equal portions. Turn each piece to coat with flour. Form each piece into a ball and flatten with the palm of your hand. Cover flattened balls of dough with a clean kitchen towel and allow to rest for at least 15 minutes (or as much as 2 hours) before proceeding., After the rest period, heat a large pan over medium heat. Roll each dough piece into a rough circle, about 6-7 inches in diameter, keep work surface and rolling pin lightly floured. Don’t stack uncooked tortillas on top of each other or they will stick together. (I like to separate my tortillas with parchement paper.), When the pan is hot, place one dough circle into the pan and allow to cook 45 seconds to 1 minute or until the bottom surface has a few pale brown spots and the uncooked surface is bubbly. If browning too fast, reduce the heat a bit. If it’s taking longer than a minute to see a few pale golden brown spots on the underside of tortillas, increase the heat a bit. Flip to other side and cook for 15-20 seconds. The tortillas should be nice and soft but have a few small brown spots on the surface., Remove from pan with tongs and stack in a covered container or zippered bag to keep the tortillas soft., Serve warm or allow to cool for later use. When ready to use, place a slightly damp paper towel in the bottom of a microwave-safe container (with a cover) that will hold the stacked tortillas. Microwave uncovered for 15-30 seconds (start with 15) or until warm, then keep covered to hold heat while serving., Store in an airtight container or zippered bag at room temperature for 24 hours or refrigerate for up to 1 week. To freeze, separate tortillas with parchment paper or waxed paper and place in a zippered bag before placing in the freezer.","[('flour', 3.0, 'cups'), ('salt', 1.0, 'teaspoon'), ('baking powder', 1.0, 'teaspoon'), ('olive oil', 0.33, 'cup'), ('water', 1.0, 'cup')]"
49ed0781,https://www.allrecipes.com/recipe/280218/moms-fresh-cranberry-pumpkin-bread/,Mom's Fresh Cranberry-Pumpkin Bread,"1 serving cooking spray, 3 ½ cups all-purpose flour, 2 ½ cups white sugar, 1 ½ tablespoons pumpkin pie spice, 2 teaspoons baking soda, 1 ½ cups canned pumpkin puree, 4 eggs, ⅔ cup milk, ½ cup canola oil, 1 (12 ounce) package fresh cranberries","Preheat the oven to 325 degrees F (165 degrees C). Grease two 9x5-inch loaf pan with cooking spray., Combine flour, sugar, pumpkin pie spice, and baking soda in a large bowl., Combine pumpkin puree, eggs, milk, and oil in a separate bowl. Add to the dry ingredients and beat until well combined. Add cranberries and stir to blend. Divide batter between the prepared pans., Bake in the preheated oven until a toothpick inserted into the center comes out clean, about 1 hour. Cool in the pans for 10 minutes, then remove to cooling racks to cool completely.","[('flour', 3.5, 'cups'), ('sugar', 2.5, 'cups'), ('pumpkin pie spice', 1.5, 'tablespoons'), ('baking soda', 2.0, 'teaspoons'), ('pumpkin puree', 1.5, 'cups'), ('eggs', 4.0, None), ('milk', 0.67, 'cup'), ('canola oil', 0.5, 'cup'), ('cranberries', 12.0, 'ounce')]"
