ID,URL,Recipe Name,Ingredients,Instructions,Processed Ingredients
533897fb,https://alexandracooks.com/2012/03/08/mrs-myers-banana-bread/,Mrs. Myers' Banana Bread,"2 cups (424 g) sugar, 1 cup (226 g) butter, softened, 3 cups (384 g) sifted flour (or not … I never sift), 1 tsp. baking soda, 1 tsp. table salt or 1.5 teaspoons kosher salt, 4 to 5 eggs, see notes above, 2 tsp. vanilla extract, 1 cup nuts, optional (I never add nuts), 1/2 cup buttermilk, 1 quart mashed bananas, about 6 to 8 (ripe to overripe)","Preheat the oven to 350ºF. Butter two 8.5 x 4.5-inch loaf pans. (Butter generously to ensure no sticking.), In a stand mixer, cream butter and sugar until light and fluffy., Meanwhile, in a separate bowl, whisk together flour, baking soda and salt., With the mixer on low, add the eggs one at a time, beating after each addition. Add the vanilla, buttermilk and bananas., Add the flour mixture in two additions, and mix until just combined. Divide batter between the two prepared pans. Bake for approximately 1 hour., Remove from oven and turn loaves out onto cooling rack immediately. Let cool.","[('sugar', 424.0, 'g'), ('butter', 226.0, 'g'), ('flour', 384.0, 'g'), ('baking soda', 1.0, 'tsp'), ('table salt', 1.0, 'tsp'), ('kosher salt', 1.5, 'tsp'), ('eggs', 4.0, None), ('vanilla extract', 2.0, 'tsp'), ('nuts', 1.0, 'cup'), ('buttermilk', 0.5, 'cup'), ('bananas', 1.0, 'quart')]"
6c87fc52,https://mysweetgreek.com/recipes/bread/tsoureki-recipe-for-a-sweet-greek-easter-bread/,Tsoureki Recipe for a Sweet Greek Easter Bread,"For the Bread, 2 packages dry yeast, 1 cup warm milk (98ºF), 3 large eggs, 3/4 cup sugar, plus 1 teaspoon, 1/4 pound unsalted butter, melted, 1 teaspoon malhepi (crushed) or Mastiha (both are optional), 1 teaspoon vanilla, 1/2 teaspoon anise extract (optional), 5 to 6 cups all purpose flour, oil for greasing bowl, For the Glaze, 1 egg, 2 teaspoons milk, Sesame seeds or slivered almonds","Dissolve yeast in 1/2 cup of warm water (around 98 degrees) with a teaspoon of sugar. Cover with plastic wrap and let bloom for 10 minutes. You should see bubbles and activity from the yeast. If you don't, then your yeast might be dead., Using the paddle attachment on your mixer, beat the eggs with the sugar. Add the melted butter, malhepi, salt, vanilla, anise, yeast mixture, and milk, until they're combined really well., Switch out the paddle attachment on your mixer for the dough hook., Gradually beat in 5 cups of flour. If the dough is still very sticky at this point, add additional flour until it starts to pull away from the side of the bowl., Turn out the dough onto a lightly floured surface and work in just enough of the remaining flour until a soft, not sticky, dough forms. Knead the dough by turning and pushing with the heel of your hand for 10 minutes (this will be a nice workout for you). The dough will become smooth and elastic., Grease a bowl with oil. Press the dough into the greased bowl and then turn the dough over so that both sides of it are greased., Cover the bowl with plastic wrap or a kitchen towel, and allow it to rise in a warm draft-free spot for about an hour and a half, or until it has doubled in size., Grease your baking pans or a cookie sheet, or line them with parchment paper., Turn the dough out onto a floured surface., Punch down the dough. Divide it into your desired portions. For 1 large 12 x 2 1/2-inch round pan, divide the dough into three equal portions. Roll each portion into a 30-inch rope. Braid the 3 ropes together, seal the ends, and form the braid into a circle. Gently lay the dough circle into the greased pan., For two braided loaves, divide the dough in half, then divide each half into three equal pieces. Roll each piece into a 14-inch rope, keeping the strip thicker in the center and tapering at the ends. Braid 3 strips together and seal the ends. Gently lay each braid on a greased (or parchment-lined) baking sheet., Cover each loaf with a towel, and allow to rest in a warm, draft-free place for 1 1/2 to 2 hours for the large loaf, or 1 to 1 1/2 hours for the smaller loaves, or until they have increased in size., ***To know if the dough has properly proofed, press it with your thumb or knuckle, if it springs back slowly and leaves a small indentation then it is proofed properly. If you springs back quickly, then it needs more time. If a deep groove remains, then it is over-proofed., Prepare the glaze by combining the egg with the milk. Brush the dough with the glaze. Then sprinkle with sesame seeds or slivered almonds., Bake in a preheated 375-degree oven for 45-55 minutes for the large loaf, and 30 to 35 minutes for the small loaves. Use a digital thermometer to make sure your bread is properly baked. Insert it halfway down into the center of the loaf. It should be 190ºF. Remove the bread immediately from the pans and allow to cool on a rack., The bread can be stored in plastic bags and frozen up to three months.","[('dry yeast', 2.0, 'packages'), ('milk', 1.0, 'cup'), ('eggs', 3.0, None), ('sugar', 0.75, 'cup'), ('unsalted butter', 0.25, 'pound'), ('malhepi', 1.0, 'teaspoon'), ('mastiha', 1.0, 'teaspoon'), ('vanilla', 1.0, 'teaspoon'), ('anise extract', 0.5, 'teaspoon'), ('all purpose flour', 5.0, 'cups'), ('egg', 1.0, None), ('milk', 2.0, 'teaspoons'), ('sesame seeds', 1.0, None)]"
f913cba2,https://www.paleorunningmomma.com/hearty-paleo-sweet-potato-bread/,Hearty Paleo Sweet Potato Bread,"4 large eggs, 1/2 cup mashed sweet potato* - white sweet potato recommended**, 5 tbsp organic coconut oil (melted and cooled to almond room temp), 1 tsp pure maple syrup (or raw honey), 1 tbsp raw apple cider vinegar, 1 cup + 5 Tbsp blanched almond flour, 3 Tbsp coconut flour, 1/4 cup tapioca flour, 1 tsp baking soda, 1/2 tsp plus a pinch of fine grain sea salt","Preheat your oven to 350 degrees and line an 8 x 4"" loaf pan*** (medium) with parchment paper, In a large mixing bowl whisk the eggs with the mashed sweet potato until smooth. Whisk in the coconut oil, honey or maple and vinegar until combined (don't over-beat), In a separate medium bowl, combine the almond, coconut, and tapioca flours, baking soda, and salt., Slowly and carefully mix the dry ingredients into the wet, without over-mixing the batter - mix until just moistened., Transfer the batter with a rubber spatula into the parchment lined loaf pan, and bake in the preheated oven for 1 hour (you can check around 50 minutes - the top of the loaf should be nicely browned and a toothpick inserted in the center should come out totally clean., Allow the loaf to cool for about 10 minutes in the load pan, then transfer (grabbing both sides of parchment paper) to a wire rack to cool for at least 1-2 hours before slicing., Store leftovers in the refrigerator, tightly wrapped in plastic or parchment paper, and enjoy! This bread is great toasted with nut butter, pastured butter, with eggs, or even as a sandwich bread.","[('eggs', 4.0, 'large'), ('sweet potato', 0.5, 'cup'), ('coconut oil', 5.0, 'tbsp'), ('maple syrup', 1.0, 'tsp'), ('apple cider vinegar', 1.0, 'tbsp'), ('almond flour', 1.31, 'cup'), ('coconut flour', 3.0, 'tbsp'), ('tapioca flour', 0.25, 'cup'), ('baking soda', 1.0, 'tsp'), ('sea salt', 0.5, 'tsp')]"
5cf0e7a9,https://www.epicurious.com/recipes/food/views/sweet-potato-and-zucchini-bread-2674,Sweet Potato and Zucchini Bread,"2 cups all purpose flour, 2 teaspoons ground cinnamon, 1 teaspoon baking soda, 1/4 teaspoon baking powder, 1/4 teaspoon salt, 2 cups sugar, 3/4 cup vegetable oil, 3 large eggs, 1 teaspoon vanilla extract, 1 1/2 cups grated zucchini, 1 1/2 cups grated peeled sweet potato, 1 cup chopped walnuts, toasted","Preheat oven to 350°F. Butter and flour 9x5x3-inch loaf pan. Sift first 5 ingredients into medium bowl. Beat sugar, oil, eggs and vanilla to blend in large bowl. Mix in zucchini and sweet potato. Add dry ingredients and walnuts and stir well., Transfer batter to prepared pan. Bake until tester inserted into center comes out clean, about 1 hour 20 minutes. Cool bread in pan on rack 15 minutes. Cut around bread to loosen. Turn out onto rack and cool completely. (Can be prepared 1 day ahead. Wrap in foil and let stand at room temperature.)","[('all purpose flour', 2.0, 'cups'), ('cinnamon', 2.0, 'teaspoons'), ('baking soda', 1.0, 'teaspoon'), ('baking powder', 0.25, 'teaspoon'), ('salt', 0.25, 'teaspoon'), ('sugar', 2.0, 'cups'), ('vegetable oil', 0.75, 'cup'), ('eggs', 3.0, None), ('vanilla extract', 1.0, 'teaspoon'), ('zucchini', 1.5, 'cups'), ('sweet potato', 1.5, 'cups'), ('walnuts', 1.0, 'cup')]"
2eff636c,https://www.homesicktexan.com/sweet-potato-bread/,Sweet potato bread,"1 3/4 cups all-purpose flour, 1 teaspoon baking soda, 1 teaspoon ground cinnamon, 1/2 teaspoon ground clove, 1/4 teaspoon ground ginger, 1/4 teaspoon ground nutmeg, 1/4 teaspoon kosher salt, 1/2 cup chopped pecans, 2 tablespoons fresh orange zest, 2 eggs, 1 tablespoon vanilla extract, 1 cup sugar, 1/2 cup brown sugar, 1/2 cup vegetable oil, 1 cup baked sweet potato, mashed","Preheat the oven to 350°F and lightly grease a 10-inch skillet., In a large bowl, whisk together the flour, baking soda, cinnamon, clove, ginger, nutmeg, salt, pecans, and orange zest until well combined., In a separate bowl, whisk together the eggs, vanilla, sugar, brown sugar, oil, and sweet potato until well blended. Pour the wet ingredients into the dry ingredients, and stir until well blended. The batter will be thick., Evenly spread the cake batter in the skillet then bake uncovered for 30 minutes or until browned and an inserted knife comes out clean., Serve warm. Will keep covered for 5 days.","[('flour', 1.75, 'cups'), ('baking soda', 1.0, 'teaspoon'), ('cinnamon', 1.0, 'teaspoon'), ('clove', 0.5, 'teaspoon'), ('ginger', 0.25, 'teaspoon'), ('nutmeg', 0.25, 'teaspoon'), ('salt', 0.25, 'teaspoon'), ('pecans', 0.5, 'cup'), ('orange zest', 2.0, 'tablespoons'), ('eggs', 2.0, None), ('vanilla extract', 1.0, 'tablespoon'), ('sugar', 1.0, 'cup'), ('brown sugar', 0.5, 'cup'), ('vegetable oil', 0.5, 'cup'), ('sweet potato', 1.0, 'cup')]"
230ae02e,https://fortheloveofsazon.com/sweet-plantain-bread-with-coconut-and-chocolate-chips/,Sweet Plantain Bread with Coconut and Chocolate Chips,"1½ cup Sweet plantains (smashed), 1 cup Brown Sugar, 1 Large Egg, 1 stick Butter (melted), 1 tsp Vanilla extract, 1 cup Semi-sweet chocolate chips, 1 cup Coconut, 2 cups Allpurpose flour, 1 tsp Baking powder, 1 tsp Baking soda, ¼ cup Sweet plantain chip crumbs","Pre-heat your oven to 325°F., Peel and smash your sweet plantains and add to a bowl. Add the egg, butter, brown sugar, and vanilla extract. Stir to combine. After add the semi-sweet chocolate chips and coconut to the mix and combine., In a seperate bowl, sift the flour, baking powder and baking soda together. Slowly add it to your sweet plantain mixture while contionusly stirring., Coat a bread pan with non-stick oil. Add your mixture to the pan. Top off with your sweet plantain chip crumbs, semi-sweet chocolate chips and coconut., Place in the oven for 45 minutes. After 45 minutes, cover with alumninum foil, and cook for another 10 minutes, until a knife comes out clean., Serve and enjoy!","[('plantains', 1.0, 'cup'), ('sugar', 1.0, 'cup'), ('egg', 1.0, None), ('butter', 1.0, 'stick'), ('vanilla', 1.0, 'tsp'), ('chocolate chips', 1.0, 'cup'), ('coconut', 1.0, 'cup'), ('flour', 2.0, 'cups'), ('baking powder', 1.0, 'tsp'), ('baking soda', 1.0, 'tsp'), ('plantain chip crumbs', 0.25, 'cup')]"
cb494dab,https://julieblanner.com/sweet-bread-recipe/,Sweet Bread Recipe,"2 cups white granulated sugar, 4 cups all purpose flour, 2 tablespoons baking powder, 1 teaspoon salt, 2 large eggs, 2 cups milk, ⅔ cup vegetable oil","Grease 6 mini loaf pans and preheat oven to 350℉., In a medium mixing bowl, add sugar, flour, baking powder and salt and whisk to combine., In a large mixing bowl, beat eggs, milk and oil until just combined., Gradually add dry mixture to wet until just moist., Pour batter into prepared loaf pans an inch below to compensate for rise. Optional: sprinkle sugar on top., Bake 40 minutes or until a toothpick inserted into the center of the loaf comes out clean.","[('sugar', 2.0, 'cups'), ('flour', 4.0, 'cups'), ('baking powder', 2.0, 'tablespoons'), ('salt', 1.0, 'teaspoon'), ('eggs', 2.0, None), ('milk', 2.0, 'cups'), ('vegetable oil', 0.67, 'cups')]"
0cf24871,https://sallysbakingaddiction.com/cinnamon-swirl-quick-bread/,Cinnamon Swirl Quick Bread,"1/2 cup (100g) granulated sugar, 1 Tablespoon ground cinnamon, 2 cups (250g) all-purpose flour (spooned & leveled), 1 teaspoon baking soda, 1/2 teaspoon salt, 1 large egg, at room temperature, 3/4 cup (150g) granulated sugar, 1/3 cup (80ml) vegetable oil, 1/3 cup (80g) sour cream (or plain yogurt/Greek yogurt), at room temperature*, 2/3 cup (160ml) whole milk, at room temperature*, 1 and 1/2 teaspoons pure vanilla extract, optional: vanilla icing","Preheat oven to 350°F (177°C). Spray a 9×5-inch or 8×4-inch loaf pan with nonstick spray., Cinnamon Swirl, Mix the 1/2 cup (100g) granulated sugar and 1 Tablespoon of ground cinnamon together., Bread, Whisk the flour, baking soda, and salt together in a large bowl. In a medium bowl, whisk the egg and 3/4 cup (150g) granulated sugar together until combined. Whisk in the oil, sour cream, milk, and vanilla extract. Pour the wet ingredients into the dry ingredients, then whisk to completely combine. Avoid over-mixing. You will have about 3 cups of batter., Pour/spread half of the batter into prepared loaf pan. Sprinkle almost all of the cinnamon sugar evenly on top (reserve about 2 Tablespoons for topping). It’s a very thick layer of cinnamon sugar. Carefully pour/spread remaining batter evenly on top. The top layer of batter will want to stick to the cinnamon sugar filling, making spreading a little tougher to do, but use a spoon to carefully spread it out as best you can. Sprinkle with the rest of the cinnamon sugar. Using a knife, make a large swirl down the loaf pan, as shown in the video tutorial below. Avoid over-swirling, which will mix the layers together too much., Bake the bread for 50-65 minutes, covering loosely with foil about halfway through to prevent the top from over-browning. Bread baked in an 8×4-inch pan takes closer to 65 minutes. Poke the center of the bread with a toothpick. If it comes out clean, the bread is done. Bake time varies between ovens. Remove from the oven and allow the bread to cool in the pan set on a wire rack for 1 hour. After that, remove the bread from the pan and let it cool directly on a wire rack., Drizzle with icing, if using. Slice and serve. Cover and store leftover bread at room temperature for up to 2 days or in the refrigerator for up to 1 week.","[('granulated sugar', 100.0, 'g'), ('ground cinnamon', 1.0, 'tablespoon'), ('all-purpose flour', 250.0, 'g'), ('baking soda', 1.0, 'teaspoon'), ('salt', 0.5, 'teaspoon'), ('egg', 1.0, None), ('granulated sugar', 150.0, 'g'), ('vegetable oil', 80.0, 'ml'), ('sour cream', 80.0, 'g'), ('whole milk', 160.0, 'ml'), ('vanilla extract', 1.5, 'teaspoons')]"
e56aa5e5,https://www.sweetrecipeas.com/2022/04/06/neapolitan-banana-bread-recipe/,Neapolitan Banana Bread Recipe,"2 ¼ cups all-purpose flour, 1 TBSP baking powder, 1 tsp baking soda, ¼ tsp salt, ½ cup sour cream, ½ cup mascarpone cheese, 6 ounce unsalted butter, at room temperature, 1 tsp vanilla bean paste, 1 cup sugar, 2 large eggs, 2 fully ripe bananas, pureed, 3 TBSP unsweetened cocoa powder, 1/3 cup mini chocolate chips, 3 TBSP freeze dried strawberry powder, For the Chocolate Glaze:, 1 1/2 cups powdered sugar, 2 TBSP unsweetened cocoa powder, 3 TBSP milk (more if need thinner), For the Vanilla Glaze:, 1 1/2 cups powdered sugar, 1 tsp vanilla bean paste, 3 TBSP milk (more if need thinner), For the Strawberry Glaze:, 1 1/2 cups powdered sugar, 2 TBSP freeze dried strawberry powder, 3 TBSP milk (more if need thinner)","Preheat oven to 350F., Grease and flour a 9-x-5-3-inch loaf pan or four mini pans., Sift flour, baking powder, baking soda and salt into a medium bowl and set aside., Combine the sour cream and mascarpone cheese in a small bowl and set aside., Using a standing mixer fitted with a paddle attachment beat the butter with the cinnamon on high speed until soft and creamy, about 1 minute., Slowly add the sugar, 1 TBSP at a time, beating continuously on high speed. It should take 5 to 10 minutes to add the sugar. The mixture should be light, fluffy and creamy white in color., Stop the mixer and scrape down the sides of the bowl with a rubber spatula., Add the eggs, one at a time. Be sure each egg is completely incorporated and scrape down the sides of the bowl before adding the next., Add one third of the flour mixture to the batter and beat until it is just incorporated., Add one third of the mascarpone cheese mixture and mix until just incorporated., Add the flour and mascarpone mixture in two more additions, mixing until addition is incorporated before adding the next., Fold in the bananas and mix until just incorporated., Divide the mixture up among three medium bowls., In the first bowl add the 3 TBSP unsweetened cocoa powder and the chocolate chips and mix until thoroughly combined., In the second bowl add the 3 TBSP freeze dried strawberry powder and mix until thoroughly combined., Leave the third bowl alone., If doing the single large loaf layer the chocolate, then vanilla, and then strawberry batter. If doing the minis use a mini scoop to scoop four scoops of chocolate in each one, four of vanilla in each one, and four of strawberry in each one., Bake for 1 hour and 15 minutes for the large loaf or 40-45 minutes for the mini loaves., Cool in the pan on a rack for 5-10 minutes, then remove from pan and set on rack to cool. Will keep for one week in fridge or 3 weeks in freezer without glaze., For the Chocolate Glaze:, Mix all the ingredients together. You want a thicker glaze. But if too thick, add more milk to thin. Pour over one third of the the loaf or mini loaves., For the Vanilla Glaze:, Mix all the ingredients together. You want a thicker glaze. But if too thick, add more milk to thin. Pour over one third of the the loaf or mini loaves next to the chocolate glaze., For the Strawberry Glaze:, Mix all the ingredients together. You want a thicker glaze. But if too thick, add more milk to thin. Pour over one third of the the loaf or mini loaves next to the vanilla glaze., Let glazes set up, about 30 minutes to an hour.","[('flour', 2.25, 'cups'), ('baking powder', 1.0, 'tbsp'), ('baking soda', 1.0, 'tsp'), ('salt', 0.25, 'tsp'), ('sour cream', 0.5, 'cup'), ('mascarpone cheese', 0.5, 'cup'), ('butter', 6.0, 'ounce'), ('vanilla bean paste', 1.0, 'tsp'), ('sugar', 1.0, 'cup'), ('eggs', 2.0, None), ('bananas', 2.0, None), ('cocoa powder', 3.0, 'tbsp'), ('chocolate chips', 0.333, 'cup'), ('strawberry powder', 3.0, 'tbsp'), ('powdered sugar', 1.5, 'cups'), ('milk', 3.0, 'tbsp')]"
ea35fb00,https://plantbasedcookingshow.com/2017/09/17/vegan-sweet-potato-flat-bread/,Vegan Sweet Potato Flat Bread,"1 cup sweet potato purée, 1 medjool date, 1 cup gluten free flour, 1/2 cup arrowroot powder, 1 tsp baking powder","Peel and dice up 1 large sweet potato., Boil until soft., Put into a blender with the date and blend until there are no more date chunks., Put the flours and baking powder into a bowl and stir., Add blender mixture to the flour and mix., Divide into 8 balls. Roll out each ball onto a piece of baking paper sprinkled with gluten free flour., Fry flat breads on a cast iron griddle or non stick pan.","[('sweet potato purée', 1.0, 'cup'), ('date', 1.0, None), ('gluten free flour', 1.0, 'cup'), ('arrowroot powder', 0.5, 'cup'), ('baking powder', 1.0, 'tsp')]"
27f658cc,https://thenaturalnurturer.com/sweet-potato-banana-bread/,Sweet Potato Banana Bread,"3/4 cup cooked and mashed sweet potato (can sub with canned sweet potato puree), 3/4 cup mashed ripe banana, 1/4 cup maple syrup or honey, 1/4 cup melted coconut oil or avocado oil, 1 teaspoon apple cider vinegar (can sub lemon juice), 2 teaspoons vanilla extract, 2 eggs, 1 1/2 cups whole wheat flour, 2 teaspoons cinnamon, 1 teaspoon baking powder, 1/2 teaspoon baking soda, 1/2 teaspoon salt, 1/3 cup chocolate chips","Preheat an oven to 350 ℉ and line a loaf pan with parchment paper or grease it with extra oil to prevent sticking., In a blender combine mashed sweet potato, mashed banana, maple syrup/honey, eggs, vanilla, oil, and vinegar and blend until smooth. Set aside., In a medium bowl, combine flour, baking powder, baking soda, salt, and cinnamon. Stir together and then pour the contents of the blender into the bowl with the dry ingredients. Mix until well combined and batter has a smooth consistency., Fold in chocolate chips, reserving some for the top of the bread, if desired., Pour batter into the prepared loaf pan, using a spatula to spread the batter evenly throughout the pan. Top with a few reserved chocolate chips, if desired., Bake in the preheated oven for 35-40 minutes., Let loaf cool in pan for 15 minutes before transferring it to a wire cooling rack. Slice into 8 pieces and enjoy!, Let cool completely and store in an air-tight container in fridge for up to 4 days or in the freezer for a month.","[('sweet potato', 0.75, 'cup'), ('banana', 0.75, 'cup'), ('maple syrup', 0.25, 'cup'), ('coconut oil', 0.25, 'cup'), ('avocado oil', 0.25, 'cup'), ('apple cider vinegar', 1.0, 'teaspoon'), ('vanilla extract', 2.0, 'teaspoons'), ('egg', 2.0, None), ('wheat flour', 1.5, 'cups'), ('cinnamon', 2.0, 'teaspoons'), ('baking powder', 1.0, 'teaspoon'), ('baking soda', 0.5, 'teaspoon'), ('salt', 0.5, 'teaspoon'), ('chocolate chips', 0.33, 'cup')]"
eb267275,https://divascancook.com/sweet-dinner-rolls-recipe-without-bread-machine-scratch/,Sweet Dinner Rolls (No Bread Machine),"1/3 cup very warm water, 1 envelope active dry yeast (2 1/4 tsp), 5 Tablespoons + 1/4 teaspoon sugar, 1 1/3 cups warm whole milk, 1 large egg (slightly beaten (room temperature)), 1 1/2 tsp salt, 5 tablespoons butter (chopped and softened), 4 cups all-purpose flour (may need more), HONEY BUTTER, 4 Tablespoons butter (softened), 3 Tablespoons honey, 3 Tablespoons confectioners sugar","In a small bowl add warm water., Sprinkle in the yeast and 1/4 teaspoon of sugar., Stir gently until combined., Let mixture rest for 10 minutes until foamy., Pour yeast mixture into a large bowl and add 5 tablespoons sugar, warm milk, egg, salt, and butter., Mix until well combined., Gradually add in flour, mixing well after each addition. (you will need to switch to using a rubber spatula once the mixture becomes a sticky dough), Transfer dough to a large, greased bowl., Cover bowl with plastic wrap and place in a warm, draft-free area for about 2 hours or until doubled in size., Grease knuckles and punch dough down to release the air., Transfer dough to a floured surface., Add just enough flour to dough and hands to handle dough without it sticking to your hands., Divide dough into two equal balls., Roll out the balls into 13-inch circles (like a pizza), Slice the dough with a pizza cutter into small wedges., Brush dough with honey butter., Flour your fingertips and roll each wedge up starting at the widest end., Place rolls on a greased cookie sheet, pointed tip tucked under., Cover with plastic wrap and place in a warm area until rolls are doubled in size, about 1 hour., Preheat oven to 375., Remove plastic wrap and bake for 15-20 minutes or until golden., Brush hot rolls with leftover honey butter., Serve hot!, To Make Honey Butter: Combine all honey butter ingredients. Stir until creamy.","[('water', 0.33, 'cup'), ('yeast', 1.0, 'envelope'), ('sugar', 5.25, 'tablespoons'), ('milk', 1.33, 'cups'), ('egg', 1.0, None), ('salt', 1.5, 'tsp'), ('butter', 5.0, 'tablespoons'), ('flour', 4.0, 'cups'), ('butter', 4.0, 'tablespoons'), ('honey', 3.0, 'tablespoons'), ('sugar', 3.0, 'tablespoons')]"
